Dis No,Country,Region,Continent,Location,Total Deaths,No Injured,No Affected,No Homeless,Total Affected,Reconstruction Costs,Insured Damages,Total Damages
2015-0540-TZA,"Tanzania, United Republic of",Eastern Africa,Africa,"Dar es Salaam (Kinondoni district); Morogoro, Kigoma, Dodoma, Geita, Mwanza, Mara, Arusha, Tabora; Tanga, Shinyanga, Singida, Cost and Zanzibar",542.0,32879.0,,,32879.0,,,
2015-0541-TZA,"Tanzania, United Republic of",Eastern Africa,Africa,"Nyarugusu refugee camp (Border with Burundi); Dar es Salaam, Mwanza, Arusha, Tanga",40.0,4833.0,,,4833.0,,,
2015-0205-TZA,"Tanzania, United Republic of",Eastern Africa,Africa,"Dar-es-salaam, Arusha, Kilimanjaro, Tanga, Kagera provinces",12.0,,,5000.0,5000.0,,,
2015-0363-URY,Uruguay,South America,Americas,"Durazno, Treinta Y Tres, Soriano, Tacuarembo provinces",,,2326.0,,2326.0,,,
2015-0551-URY,Uruguay,South America,Americas,"Artigas, Cerro Largo, Paysandu, Rivera, Salto, Tacuarembo provinces",,,16000.0,,16000.0,,,
2015-0498-URY,Uruguay,South America,Americas,"Artigas, Salto, Rivera,Tacuarembó, Paysandu, Cerro Largo province",,,10000.0,,10000.0,,,
2015-0177-USA,United States of America (the),Northern America,Americas,"Nashville town (Howard district, Arkansas province); Van town (Van Zandt district, Texas province), Delmond town (Douglas district, South Dakota province), Colorado, Oklahoma, Kansas, Iowa provinces",6.0,,,,,,,1000000.0
2015-0025-USA,United States of America (the),Northern America,Americas,"Illinois, Wisconsin, Pennsylvania provinces",15.0,,,,,,,100000.0
2015-0073-USA,United States of America (the),Northern America,Americas,"Massachusetts, New York, Tennessee, Maryland, Virginia, Pennsylvania, Kentucky, North Carolina, Michigan, Rhode Island, New Hampshire, Ohio, South Carolina, Illinois, District of Columbia, Maine, Vermont provinces",30.0,,,,,,2000000.0,3000000.0
2015-0122-USA,United States of America (the),Northern America,Americas,"New York, Pennsylvania, Kentucky, West Virginia, Arkansas provinces",13.0,,,,,,200000.0,170000.0
2015-0186-USA,United States of America (the),Northern America,Americas,"San Marcos area (Hays district, Texas province), Claremore area (Hays district, Oklahoma province)",16.0,,12000.0,,12000.0,,,
2015-0431-USA,United States of America (the),Northern America,Americas,"Hildale town (Washington district, Utah province), Las Vegas town (Clark district, Nevada province)",19.0,,,,,,,2000.0
2015-0421-USA,United States of America (the),Northern America,Americas,"Lake, Napa, Sonoma, Butte districts (California province)",4.0,,,7302.0,7302.0,,960000.0,1400000.0
2015-0613-USA,United States of America (the),Northern America,Americas,"Amador, Calaveras (California)",3.0,,,1425.0,1425.0,,450000.0,400000.0
2015-9210-USA,United States of America (the),Northern America,Americas,"California, Nevada, Oregon, Washington, Idaho, Montana, Utah, Arizona provinces",,,,,,,,1800000.0
2015-0312-USA,United States of America (the),Northern America,Americas,"Lake, Napa, Solano, Yolo, Modoc, Colusa districts (California province)",1.0,,,129.0,129.0,,,2000.0
2015-0399-USA,United States of America (the),Northern America,Americas,"Hillsborough, Pasco, Pinellas, Dixie, Taylor districts (Florida province)",,,600.0,,600.0,,,100000.0
2015-0296-VEN,Venezuela (Bolivarian Republic of),South America,Americas,"Apure, Tachira, Merida, Zulia provinces",,,45297.0,,45297.0,,,
2015-0252-VNM,Viet Nam,South-Eastern Asia,Asia,Son La province,7.0,,,115.0,115.0,,,
2015-9617-VNM,Viet Nam,South-Eastern Asia,Asia,"An Giang, Ba Ria-Vung Tau, Ben Tre, Binh Dinh, Binh Duong, Binh Phuoc, Binh Thuan, Can Tho city, Dak Lak, Dak Nong, Dong Nai, Dong Thap, Gia Lai, Hau Giang, Ho Chi Minh City, Khanh Hoa, Kon Tum, Lam Dong, Long An, Ninh Thuan, Phu Yen, Quang Nam, Quang Ngai, Soc Trang, Tay Ninh, Tien Giang, Tra Vinh, Vinh Long provinces",,,1750000.0,,1750000.0,,,6750000.0
2015-0460-VNM,Viet Nam,South-Eastern Asia,Asia,"Minh Tien village (Vi Xuyen district, Ha Giang province), Khanh Hoa, Cao Bang, Lai Chau, Dong Na, Lam Dong, Binh Thuan, An Giang, Dong Thap provinces",2.0,,100.0,,100.0,,,
2015-9483-WSM,Samoa,Polynesia,Oceania,"Upolu Isl., Savaii Isl.",,,,,,,,
2015-0484-YEM,Yemen,Western Asia,Asia,"Abyan, Hadramaut, Shabwah provinces",8.0,65.0,110000.0,,110065.0,,,200000.0
2015-0302-YEM,Yemen,Western Asia,Asia,"Hodeidah, Lahj, Hadramout, Aden, Taiz, Shabwa",3.0,,3026.0,,3026.0,,,
2015-0336-COD,Congo (the Democratic Republic of the),Middle Africa,Africa,"Kabare, Bukavu (South Kivu)",3.0,30.0,260.0,100.0,390.0,,,
2015-0385-COD,Congo (the Democratic Republic of the),Middle Africa,Africa,"Katanga, Maniema provinces",3.0,,57003.0,,57003.0,,,
2015-0536-COD,Congo (the Democratic Republic of the),Middle Africa,Africa,"Debonhome, Ndanu, Kingabua, Pécheur, Salongo boroughs (Kinshasa district, Kinshasa province)",31.0,,10560.0,,10560.0,,,
2015-0549-COD,Congo (the Democratic Republic of the),Middle Africa,Africa,"Tshopo, Haut-Uele districts (Orientale province)",,,180000.0,,180000.0,,,
2015-0339-MNP,Northern Mariana Islands (the),Micronesia,Oceania,Saipan island (Northern Mariana Islands province),,10.0,350.0,,360.0,,,
2015-0608-TLS,Timor-Leste,South-Eastern Asia,Asia,Dili province,,3.0,,2000.0,2003.0,,,4000.0
2015-0301-SSD,South Sudan,Northern Africa,Africa,Juba county (Central Equatoria); Bor (Jonglei state),47.0,,1818.0,,1818.0,,,
2016-0012-USA,United States of America (the),Northern America,Americas,"Ventura, Orange, San Diego, Los Angles districts (California province)",,,,,,,65000.0,125000.0
2016-0203-USA,United States of America (the),Northern America,Americas,"Greenbier district (West Virginia province); Ohio, Indiana, Illinois, Wisconsin, Virginia",25.0,,2000.0,,2000.0,,200000.0,1000000.0
2016-0379-VNM,Viet Nam,South-Eastern Asia,Asia,"Hai Phong City, Quang Ninh, Yen Bai, Phu Tho, Lai Chau, Dien Bien, Son La, Hoa Binh, Than Hoa, Lao Cai, Bac Giang, Nghe An provinces",11.0,15.0,11075.0,,11090.0,,,157.0
2016-0519-ARG,Argentina,South America,Americas,"Pergamino, Ramallo, Colón, Arrecifes, Rojas, Salto, San Nicolás, Florentino Ameghino, General Villegas, Baradero, San Antonio de Areco (Buenos Aires); Jovita (General Roca), Villa Dolores (San Javier), La Cumbre, La Falda, Villa Giardini (Punilla), Rio Ceballos, Salsipuedes, Agua de Oro, Jesús María, Colonia Caroya (Colon) (Córdoba); Maria Teresa (General Lopez), Allvarez (Rosario) (Santa Fe) ; La Paz, Parana (Entre Rios)",,,13650.0,,13650.0,,,2000.0
2016-0227-RUS,Russian Federation (the),Eastern Europe,Europe,"Dagestan Rep., Chechnya Rep., Severnaya Osetiya-alaniya Rep. provinces",,,8196.0,,8196.0,,,10000.0
2016-0125-USA,United States of America (the),Northern America,Americas,"Texas, Oklahoma, Arkansas, Louisiana, Mississippi, Kansas, Virginia, North Carolina, Georgia, Missouri, Illinois, West Virginia provinces",6.0,,,,,,2000000.0,2400000.0
2016-0322-USA,United States of America (the),Northern America,Americas,"Georgia, Florida, South Carolina, New York, New Jersey; Cedar Key, Florida, Aurora (North Carolina); Virginia Tidewater region",3.0,,13500.0,570.0,14070.0,,270000.0,600000.0
2016-0115-URY,Uruguay,South America,Americas,"All departments Artigas, Canelones, Cerro Largo, Colonia, Durazno, Flores, Florida, Lavalleja, Montevideo, Paysandu, Rio Negro, Rivera, Rocha, Salto, San Jose, Soriano (Dolores, Cadol, Barrio Paris, Centro and Altos de Dolores), Tacuarembo, Treinta Y Tres provinces",8.0,250.0,10355.0,,10605.0,,,3000.0
2016-0054-PER,Peru,South America,Americas,"Puno, Arequipa, Cusco, Junin provinces",2.0,,10000.0,,10000.0,,,2000.0
2016-0456-PHL,Philippines (the),South-Eastern Asia,Asia,"Romblon, Mindoro Oriental (Region IV (Southern Tagalog) province), Antique, Capiz, Aklan, Iloilo (Region VI (Western Visayas) province), Leyte (Region VIII (Eastern Visayas) province), Surigao del Sur, Surigao del Norte, Dinagat (Region XIII (Caraga) province)",,,14309.0,,14309.0,,,
2016-0371-PHL,Philippines (the),South-Eastern Asia,Asia,"Ilocos Norte, Ilocos Sur districts (Region I (Ilocos region) province), Cagayan, Isabela districts (Region II (Cagayan valley) province), Iloilo district (Region VI (Western Visaya) province), Northern Samar district (Region VIII (Eastern Visayas) province), Region IV (Southern Tagalog), CAR, provinces",,,8809.0,,8809.0,,,
2016-0149-RWA,Rwanda,Eastern Africa,Africa,"Gakenke, Muhanga, Rubavu, Ngororero",67.0,,,,,,,
2016-0191-TJK,Tajikistan,Central Asia,Asia,"Direct Ruled Districts (Rudaki, Nurobod, Sangvor-Talvidara, Rasht ), Sughd (Aini, Panjekent, Shahriston), Khatlon (Kulob), Gorno-Badakhshan Autonomous Oblast (Darvoz)",4.0,,12750.0,,12750.0,,,
2016-0350-TWN,Taiwan (Province of China),Eastern Asia,Asia,,7.0,160.0,,,160.0,,,110000.0
2016-0331-USA,United States of America (the),Northern America,Americas,"Minnesota; Buffalo, Chippewa, Clark, Columbia, Crawford, Eau Claire, Jackson, La Crosse, Monroe, Richland, Sauk, Trempealeau, and Vernon (Wisconsin); Allamakee, Benton, Black Hawk, Bremer, Buchanan, Butler, Cedar, Chickasaw, Delaware, Floyd, Franklin, Linn, Wright (Iowa)",1.0,,,,,,,550000.0
2016-0494-VCT,Saint Vincent and the Grenadines,Caribbean,Americas,"Sandy Bay city, Magum, Orange Hill, Overland, London, Point, Owia, Fancy villages (Charlotte province), Spring Village, Coulls Hill, Troumaca, Rose Bank, Sharpes, Fitz Hughes villages (Saint Patrick province), Chateaubelair village (Saint David province)",,,25000.0,,25000.0,,,6500.0
2016-0522-BOL,Bolivia (Plurinational State of),South America,Americas,"Tiquipaya (Quillacollo-Cochabamba department), Tipuani (Larecaja-La Paz), Lagunillas (Cordillera-Santa Cruz)",4.0,,5300.0,,5300.0,,,
2016-0522-COL,Colombia,South America,Americas,Cali city (Siloé district),6.0,,,72.0,72.0,,,
2016-0043-TWN,Taiwan (Province of China),Eastern Asia,Asia,"Tainan city (Name Unkown district, Taiwan Sheng province)",117.0,525.0,,,525.0,,370000.0,700000.0
2016-0483-SLB,Solomon Islands,Melanesia,Oceania,"Malaita, Makira-Ulawa, Temotu provinces",,1.0,9769.0,,9770.0,,,
2016-0123-USA,United States of America (the),Northern America,Americas,"Dallas-Fort Worth (Dallas, Wise, Tarrant, Denton, Parker), Wylie, Plano, Little Elm, Rockwall, Bettie, Emory in Collin, Denton, Upshur, Rockwall, Rains, San Antonio metro regions, Helotes, Alamo Heights, Kirby, Hollywood Park, Carrizo Springs, Terrel Hills (Bexar, Dimmit) (Texas), Oklahoma, Kansas, Missouri, Arkansas, Mississippi, Louisiana",1.0,,3000.0,,3000.0,,3000000.0,3900000.0
2016-0150-USA,United States of America (the),Northern America,Americas,"Oklahoma, Colorado, Nebraska, Kansas, Iowa, Missouri, Arkansas, Illinois, Kentucky, Texas,Tennessee states",2.0,10.0,,,10.0,,800000.0,1700000.0
2016-0477-USA,United States of America (the),Northern America,Americas,"Alabama, Mississippi, Tennessee, Georgia, South Carolina, Louisiana, North Carolina provinces",8.0,33.0,,,33.0,,200000.0,275000.0
2016-0086-USA,United States of America (the),Northern America,Americas,"Texas, Mississippi, Louisiana, Florida provinces",1.0,,,,,,920000.0,1200000.0
2016-0087-USA,United States of America (the),Northern America,Americas,"Texas, Oklahoma, Louisiana, Arkansas, Mississippi, Alabama, Florida provinces",,,300.0,,300.0,,1700000.0,2300000.0
2016-0427-UKR,Ukraine,Eastern Europe,Europe,Odessa province,3.0,,200.0,,200.0,,,
2016-0124-USA,United States of America (the),Northern America,Americas,"Fayette, Grimes, Harris, Parker counties, Houston districts (Texas province)",9.0,,21000.0,,21000.0,,1000000.0,2000000.0
2016-0183-USA,United States of America (the),Northern America,Americas,"Texas, Oklahoma, Arkansas, Kansas, Nebraska provinces",15.0,,,,,,200000.0,300000.0
2016-0451-COD,Congo (the Democratic Republic of the),Middle Africa,Africa,"Gemena city (Sud-Ubangi district, Equateur province)",,7.0,2628.0,,2635.0,,,
2016-0490-PHL,Philippines (the),South-Eastern Asia,Asia,"Meycauayan city, Marilao, Sta. Maria (Bulacan province)",,,1559.0,,1559.0,,,
2016-0481-SAU,Saudi Arabia,Western Asia,Asia,Qunfudah governorat (Makkah province),3.0,2.0,120.0,,122.0,,,50000.0
2016-0342-TWN,Taiwan (Province of China),Eastern Asia,Asia,,,,,,,,,70000.0
2016-0181-USA,United States of America (the),Northern America,Americas,"Houston district (Texas province), Brenham city (Washington district, Texas province); Montana, Kansas, Missouri, Colorado",9.0,12.0,,,12.0,,800000.0,1100000.0
2016-0085-USA,United States of America (the),Northern America,Americas,"California, Lousiana, Texas, Arkansas, Tennessee, Mississippi, Alabama, Oklahoma, Kentucky, Ohio provinces",7.0,,,,,,560000.0,1600000.0
2016-0355-USA,United States of America (the),Northern America,Americas,"Florida, Georgia, South Carolina, North Carolina, Virginia provinces",49.0,,,,,,5000000.0,10000000.0
2016-0362-VNM,Viet Nam,South-Eastern Asia,Asia,"Thua Thien-Hue, Quang Tri, Quang Binh, Ha Tinh, Nghe An provinces",34.0,,610000.0,,610000.0,,,350000.0
2016-0371-VNM,Viet Nam,South-Eastern Asia,Asia,"Muong Kuon, Bao Xat, Bao Thang, Sa Pa",25.0,,180000.0,2500.0,182500.0,,,144000.0
2016-9065-SSD,South Sudan,Northern Africa,Africa,"Western Bahr El Ghazal, Northern Bahr El Ghazal, Warab, Unity, Upper Nile, Jonglei, El Buheyrat, Western Equatoria, Central Equatoria, Eastern Equatoria provinces",,,3600000.0,,3600000.0,,,
2016-0010-USA,United States of America (the),Northern America,Americas,"Washington D.C. (District of Columbia district, District of Columbia province), New York, New Jersey, Pennsylvania, Maryland, Virginia, Tennessee, Kentucky, Delaware, West Virginia, Georgia, North Carolina provinces",50.0,12.0,85000000.0,,85000012.0,,240000.0,550000.0
2016-0179-POL,Poland,Eastern Europe,Europe,"Nowy Targ district (Mount Sokolica region, Malopolske province), Sucha Beskidzka district (Mount Babia Gora region, Malopolske province), Szcyrk city (Czechowice-Dziedzice district, Slaskie province)",2.0,3.0,,,3.0,,,
2016-0295-RUS,Russian Federation (the),Eastern Europe,Europe,"Moscou city (Moskva province and Moskovskaya Oblast province), Koursk city (Kurskaya Oblast province), Orel city (Orlovskaya Oblast province), Belgorod city (Belgorodskaya Oblast province)",,,300.0,,300.0,,,
2016-0051-USA,United States of America (the),Northern America,Americas,"Alabama, Mississippi, Virginia, Connecticut, Florida, Georgia, Louisiana, Massachusetts, Maryland, North Carolina, New Jersey, New York, Pennsylvania, South Carolina, Texas",10.0,12.0,,,12.0,,,1200000.0
2016-0298-PER,Peru,South America,Americas,"Yanque, Achoma (Arequipa region); Chivay, Achoma, Ichupampa, Cabanoconde, Yanque, Coporaque, Maca, Madrigal, Tapay, Lari, Tuti, Callalli (Caylloma province)",4.0,67.0,11115.0,,11182.0,,,
2016-0464-PER,Peru,South America,Americas,"Lampa, Paratia cities (Lampa district, Puno province)",1.0,17.0,200.0,40.0,257.0,,,
2016-0256-PHL,Philippines (the),South-Eastern Asia,Asia,"Zambales, Battan (Region III); Rizal, Batangas (Region IV)",2.0,2.0,3357.0,,3359.0,,,
2016-0342-PHL,Philippines (the),South-Eastern Asia,Asia,"Ilocos Norte district (Region I (Ilocos region) province), Batanes, Cagayan districts (Region II (Cagayan valley) province)",,,16648.0,,16648.0,,,4913.0
2016-0363-PHL,Philippines (the),South-Eastern Asia,Asia,"Pangasinan district (Region I (Ilocos region) province), Nueva Vizcaya, Quirino, Isabela districts (Region II (Cagayan valley) province), Aurora, Bulacan, Nueva Ecija, Zambales districts (Region III (Central Luzon) province), Quezon, Rizal, Laguna, Cavite, Batangas districts (Region IV-A (Calabarzon) province), Albay, Catanduanes, Camarines Sur, Camarines Norte, Sorsogon districts (Region V (Bicol region) province)",,,52270.0,,52270.0,,,11490.0
2016-0364-PHL,Philippines (the),South-Eastern Asia,Asia,"Ilocos Norte, Ilocos Sur, La Union, Pangasinan districts (Region I (Ilocos region) province), Cagayan, Isabela, Nueva Vizcaya, Quirino districts (Region II (Cagayan valley) province), Aurora, Bataan, Bulacan, Nueva Ecija, Pampanga, Tarlac, Zambales districts (Region III (Central Luzon) province), Batangas, Quezon, Rizal districts (Regio IV-A (Calabarzon) province), Camarines Norte, Sorgoson (Region V (Bicol region) province)), Abra, Apayao, Benguet, Ifugao, Kalinga, Mountain province (Cordillera Administrative region (CAR))",8.0,,981154.0,,981154.0,,,50690.0
2016-0503-PHL,Philippines (the),South-Eastern Asia,Asia,"Batangas, Cavite, Laguna, Quezon, Rizal (Calabarzon); Mariduque, Mindoro Occidental (Mimaropa); Albay, Camarines Norte, Camarines Sur, Catanduanes , Masbate, Sorsogon (Region V, Bicol region); Northern Samar (Region VIII, Eastern Visayas)",24.0,,1893404.0,,1893404.0,,,103661.0
2016-0377-PHL,Philippines (the),South-Eastern Asia,Asia,"National Capital Region (NCR) province, Ilocos Sur, La Union, Pangasinan districts (Region I (Ilocos Region) province), Bataan, Bulacan, Nueva Ecija, Pampanga, Tarlac, Zambales districts (Region III (Central Luzon) province), Laguna, Rizal districts (Region IV-A (Calabarzon) province), Antique, Iloilo, Negros Occidental districts (Region VI (Western Visaya) province), Abra, Benguet, Ifugao, Mountain province districts (Cordillera Administrative region (CAR) province)",26.0,,1263098.0,,1263098.0,,,9320.0
2016-0445-PHL,Philippines (the),South-Eastern Asia,Asia,"Pampanga district (Region III (Central Luzon) province), Pangasinan district (Region I (Ilocos region) province)",19.0,,1300000.0,,1300000.0,,,
2016-0001-POL,Poland,Eastern Europe,Europe,"Dolnoslaskie, Kujawsko-Pomorskie, Lodzkie, Lubeiskie, Lubuskie, Malopolske, Mazowieckie, Opolskie, Podkarpackie, Podlaskie, Slaskie, Swietokrzyskie, Warminsko-Mazurskie, Wielkopolskie, Zachodnio-Pomorskie provinces",21.0,,,,,,,
2016-0321-PRK,Korea (the Democratic People's Republic of),Eastern Asia,Asia,"Hamgyong-bukto province (North Hamgyong), Ryanggang",538.0,,667715.0,,667715.0,,,61000.0
2016-0285-PRT,Portugal,Southern Europe,Europe,"Silves district (Faro province), Funchal (Ilha Da Madeira (madeira) province, Madere Isl.)",3.0,,699.0,462.0,1161.0,,,157000.0
2016-9249-PRY,Paraguay,South America,Americas,"Alto Paraguay, Boqueron, Presidente Hayes provinces (Chaco region)",,,,,,,,
2016-0426-ROU,Romania,Eastern Europe,Europe,"Slobozia-Conachi, Cuza Voda, Pechea (Galati province), Bucuresti, Bacau, Botosani provinces",1.0,,300.0,,300.0,,,
2016-0179-ROU,Romania,Eastern Europe,Europe,"Livezi village (Bacau province), Ruginesti village (Vrancea province)",2.0,,,,,,,
2016-0128-RUS,Russian Federation (the),Eastern Europe,Europe,"Vologodskaya Oblast, Tyumenskaya Oblast, Sverdlovskaya Oblast provinces",,,3200.0,,3200.0,,,2000.0
2016-0164-RWA,Rwanda,Eastern Africa,Africa,"Gakenke district (North/Amajyaruguru province), Muhanga district (South/Amajyepfo province), Rubavu district (West/Iburengerazuba province), Ngororero districts (West/Iburengerazuba province)",54.0,,,4000.0,4000.0,,,
2016-0120-SAU,Saudi Arabia,Western Asia,Asia,"Al-Baidhani valley of Asir region, Baha and Taif (Makkah), east of Traj valley",3.0,,,,,,,
2016-0105-SAU,Saudi Arabia,Western Asia,Asia,"Jizan, Riyadh, Makkah, Madinah, Baha, Asir provinces",18.0,,915.0,,915.0,,,
2016-0274-SDN,Sudan (the),Northern Africa,Africa,"Al Gezira, Blue Nile, Gedaref, Kassala, Sennar, South Kordofan, West Kordofan, North Kordofan, North Darfur, East Darfur, Karthoum, Northern Darfur (Shamal Darfur), Southern Darfur, Western Darfur, River Nile, White Nile, Red Sea",171.0,4.0,90000.0,110000.0,200004.0,,,
2016-0344-SDN,Sudan (the),Northern Africa,Africa,"Bue Nyle, Kassala",19.0,632.0,,,632.0,,,
2016-0449-SEN,Senegal,Western Africa,Africa,"Mbane, Gaya, Gnith, Bokhol, Ronkh, Richard-Toll municipalities (Dagana district, Saint Louis province), Touba city (Kaolack district, Kaolack province), Kaffrine, Fatick provinces",5.0,106.0,10540.0,,10646.0,,,
2016-0513-SGP,Singapore,South-Eastern Asia,Asia,,,13051.0,,,13051.0,,,
2016-0392-SLB,Solomon Islands,Melanesia,Oceania,"Guadalcanal (including Honiara), Malaita, Isabel provinces",,1212.0,,,1212.0,,,
2016-0129-SOM,Somalia,Eastern Africa,Africa,"Awdal, Gedo provinces",9.0,,,,,,,
2016-9291-SWZ,Swaziland,Southern Africa,Africa,"Whole country: Hhohho, Lubombo, Manzini, Shiselweni provinces",,,492000.0,,492000.0,,,
2016-0302-SYC,Seychelles,Eastern Africa,Africa,"English river, Anse Royal, Anse Etoile, Beau Vallon, Point La Rue",,253.0,,,253.0,,,
2016-0378-THA,Thailand,South-Eastern Asia,Asia,"Nan, Phayao, Mae Hong Son, Chiang Rai provinces",3.0,,22500.0,,22500.0,,,
2016-0023-THA,Thailand,South-Eastern Asia,Asia,"Chai Nat Province, Bangkok, Chiang Rai, Phetchabum",14.0,,,,,,,
2016-0360-THA,Thailand,South-Eastern Asia,Asia,"Nakhon Sawan province, Ayutthaya (Phra Nakhon Si Ayudhya province)",4.0,,204000.0,,204000.0,,,120000.0
2016-0472-THA,Thailand,South-Eastern Asia,Asia,"Nakhon Si Thammarat, Krabi, Surat Thani, Songkhla, Phatthalung, Pattani, Chumphon, Trang, Yala, Narathiwat provinces",14.0,,582343.0,,582343.0,,,25000.0
2016-0251-TJK,Tajikistan,Central Asia,Asia,"Rasht region (Garmskiy district, Tadzhikistan Territories province)",,,155.0,,155.0,,,
2016-0004-TON,Tonga,Polynesia,Oceania,"Vava'u, Ha'apai islands (Administrative unit not available)",,,392.0,,392.0,,,
2016-0041-TON,Tonga,Polynesia,Oceania,Vava’u Isl.,,,,,,,,
2016-0141-TON,Tonga,Polynesia,Oceania,"Eua, Tongatapu, Ha'apai, Tongatapu, 'Eua, Vava'u islands (Administrative unit not available)",,,,,,,,
2016-0256-TWN,Taiwan (Province of China),Eastern Asia,Asia,,3.0,300.0,,,300.0,,,
2016-0023-TWN,Taiwan (Province of China),Eastern Asia,Asia,"Taipei, Taoyuan, Kaohsiung, Yangmingshan, the Matsu Islands, Kinmen, Miaoli County",85.0,,,,,,,
2016-0329-TZA,"Tanzania, United Republic of",Eastern Africa,Africa,"Bukoba, Karagwe, Missenyi district (Kagera province)",17.0,440.0,139161.0,,139601.0,,,458000.0
2016-0060-TZA,"Tanzania, United Republic of",Eastern Africa,Africa,"Chemichemi, Chumbi, Ikwiriri, Kiongoloni, Kipugira, Maparoni, Mgomba, Mkongo, Msala, Mtunda, Mwaseni, Muhoro, Ngorongo, Umwe, Utete wards (Rufiji district, Pwani province)",,,53446.0,,53446.0,,,
2016-0028-TZA,"Tanzania, United Republic of",Eastern Africa,Africa,"Dodoma, Mwanza, Rufiji provinces",3.0,,58896.0,,58896.0,,,
2016-0244-TZA,"Tanzania, United Republic of",Eastern Africa,Africa,"Kilosa, Kilombero, Malinyi (Morogoro province)",13.0,,14000.0,13933.0,27933.0,,,
2016-0329-UGA,Uganda,Eastern Africa,Africa,"Minziro, Kanabulemu parish (Kakuuto district, Rakai province)",4.0,,,590.0,590.0,,,
2016-0130-UGA,Uganda,Eastern Africa,Africa,"Kyebando, Bwaise, Mulago, Kalerwe suburbs (Kawempe district, Kampala province), Kamwokya suburb (Central Kampala district, Kampala province), Kanamba, Kabaka parishes (Karusandara sub-county, Busongora district, Kasese province)",,,10000.0,,10000.0,,,2700.0
2016-0148-UGA,Uganda,Eastern Africa,Africa,"Bubukwanga, Bukhonzo, Humya, and Bumadu village in Bundibugyo town council (Bundinbugyo district)",15.0,,,1000.0,1000.0,,,
2016-0001-UKR,Ukraine,Eastern Europe,Europe,"Cherkas'ka, Chernihivs'ka, Chernivets'ka, Dnipropetrovs'ka, Donets'ka, Ivano-frankivs'ka, Kharkivs'ka, Khersons'ka, Khmel'nyts'ka, Kirovohrads'ka, Krym, Kyyivs'ka, L'vivs'ka, Luhans'ka, Mykolayivs'ka, Odes'ka, Poltavs'ka, Rivnens'ka, Sums'ka, Ternopil's'ka, Vinnyts'ka, Volyns'ka, Zakarpats'ka, Zaporiz'ka, Zhytomyrs'ka",37.0,,,,,,,
2016-0493-USA,United States of America (the),Northern America,Americas,Cushing (Oklahoma),,,120.0,,120.0,,,20000.0
2016-0206-USA,United States of America (the),Northern America,Americas,California province,,,36.0,855.0,891.0,,,150000.0
2016-0264-USA,United States of America (the),Northern America,Americas,"Los Angeles, San Francisco districts (California province)",2.0,,420.0,,420.0,,,50000.0
2016-0297-USA,United States of America (the),Northern America,Americas,"Lower Lake, Clearlake (Lake district, California province)",,,,567.0,567.0,,,100000.0
2016-0463-USA,United States of America (the),Northern America,Americas,"Gatlinburg city (Sevier district, Tennessee province)",14.0,191.0,,6383.0,6574.0,,600000.0,1200000.0
2016-0170-USA,United States of America (the),Northern America,Americas,"Palestine city (Anderson district, Texas province), Houston district (Texas province)",11.0,,,,,,,
2016-0292-USA,United States of America (the),Northern America,Americas,"Louisiana, Mississippi, Missouri, Illinois, Indiana; Allamakee, Clayton, Fayette, Howard, Winneshiek counties (Iowa)",13.0,,70000.0,,70000.0,,2500000.0,10000000.0
2016-0355-VCT,Saint Vincent and the Grenadines,Caribbean,Americas,Layou (Saint Andrew),,,,,,,,
2016-0400-VNM,Viet Nam,South-Eastern Asia,Asia,"Quang Binh (Minh Hoa, Tuyen Hoa), Ha Tinh (Huong Khe), Nghe An, Quang Tri (Vinh Linh, Hai Lang, Trieu Phong), Thua Thien Hue provinces",35.0,30.0,659390.0,195.0,659615.0,,,104280.0
2016-0268-VNM,Viet Nam,South-Eastern Asia,Asia,"Nam Dinh, Thai Binh and Ninh Binh provinces",1.0,5.0,191745.0,,191750.0,,,191000.0
2016-0514-VNM,Viet Nam,South-Eastern Asia,Asia,,27.0,79204.0,,,79204.0,,,
2016-0497-VNM,Viet Nam,South-Eastern Asia,Asia,"Thua Thien - Hue, Quang Nam, Quang Ngai, Binh Dinh provinces",27.0,16.0,559255.0,2850.0,562121.0,,,35000.0
2016-0517-VNM,Viet Nam,South-Eastern Asia,Asia,"Ha Tinh (Huong Khe, Huong Son, Vu Quang, Cam Xuyen, Duc Tho), Quang Binh (Bo Trach, Quang Trach (Ba Don), Tuyen Hoan, Le Thuy, Minh Hoa), Quang Tri (Vinh Linh, Hai Lang, Trieu Phong, Cam Lo); Quang Ngai, Gia Lai, Dak Lak, Binh Dinh, Phu Yen, Khanh Hoa, Ninh Thuan",21.0,,205205.0,1135.0,206340.0,,,22000.0
2016-0120-YEM,Yemen,Western Asia,Asia,"Al Hudaydah, Amran, Hajjah, Sana'a, Hajjah, Al Mahwit, Aden, Marib provinces",20.0,,29750.0,,29750.0,,,
2016-0196-YEM,Yemen,Western Asia,Asia,"Al-Lassbah village (Al-Shamayteen mountain region, Taez province)",20.0,20.0,,,20.0,,,
2016-0440-YEM,Yemen,Western Asia,Asia,"Al Bayda, Al Hudaydah, Al Dhale's, Hajjah, Lahj, Taiz, Ibb, Amamat Al Asimah, Aden, Amran, Sanaa",11.0,180.0,,,180.0,,,
2016-0478-ZAF,South Africa,Southern Africa,Africa,"Gauteng, KwaZulu Natal provinces",6.0,,600.0,,600.0,,,100000.0
