Dis No,Country,Region,Continent,Location,Total Deaths,No Injured,No Affected,No Homeless,Total Affected,Reconstruction Costs,Insured Damages,Total Damages
2019-0021-PHL,Philippines (the),South-Eastern Asia,Asia,"Agusan del Norte, Agisan del Sur, Dinaga Isl., Surigao del Norte, Surigao del Sur (Region XIII - Caraga)",,,13160.0,,13160.0,,,
2019-0349-PHL,Philippines (the),South-Eastern Asia,Asia,"Cordillera Administrative Region, Ilocos, Cagayan Valley",4.0,,2000.0,,2000.0,,,377440.0
2019-0434-PHL,Philippines (the),South-Eastern Asia,Asia,Aurora Province,2.0,2.0,61500.0,,61502.0,,,
2019-0080-PHL,Philippines (the),South-Eastern Asia,Asia,"Luzon and Visayas in CALABARZON, Region 6 (Western Visayas) and Region 7 (Central Visayas), Region 8 (Eastern Visayas) and Region 10 (Northern Mindanao)",333.0,22967.0,,,22967.0,,,
2019-0355-PHL,Philippines (the),South-Eastern Asia,Asia,"II, IVA, V; Iloilo, Capiz, Aklan, Antique Guimaras (region VI), VII, VIII, IX, II, BARMM, NCR",492.0,106630.0,,,106630.0,,,
2019-9137-PHL,Philippines (the),South-Eastern Asia,Asia,"MIMAROPA Region, Region IX, Region XII, BARMM, Metro Manilla",,,16000.0,,16000.0,,,
2019-0264-PHL,Philippines (the),South-Eastern Asia,Asia,"Datu Salibo and Sultan sa Barongis municipalities (Maguindanao Province, Mindanao Island)",,,45000.0,,45000.0,,,
2019-0271-PNG,Papua New Guinea,Melanesia,Oceania,"New Ireland, New Britain, Duke of York Islands",,1.0,650.0,,651.0,,,
2019-0298-PNG,Papua New Guinea,Melanesia,Oceania,West New Britain,,,15800.0,,15800.0,,,
2019-0158-PNG,Papua New Guinea,Melanesia,Oceania,"Tsak valley (Wapenamanda District, Enga Province, Highlands Region)",10.0,,,,,,,
2019-0424-PRK,Korea (the Democratic People's Republic of),Eastern Asia,Asia,"Yonggwang, Yodok, Jangjin Counties; Tanchon City (South Hamgyong Province)",5.0,,5300000.0,,5300000.0,,,24000.0
2019-0150-PRY,Paraguay,South America,Americas,"Asuncion, Distrito Capital",1.0,,2000.0,,2000.0,,,
2019-0245-PRY,Paraguay,South America,Americas,"Asuncion, Pilar",23.0,,208602.0,,208602.0,,,
2019-0428-PRY,Paraguay,South America,Americas,,,,,,,,,
2019-0197-PRY,Paraguay,South America,Americas,"Ñeembucú, Presidente Hayes, Alto Paraguay, Concepción, Capital, Misiones, San Pedro, Central Departments",16.0,,310595.0,,310595.0,,,
2019-0378-RUS,Russian Federation (the),Eastern Europe,Europe,"Yakoutia (aka Sakha Rep.), Krasnoïarsk, Irkoutsk (Siberia)",,,,,,,,106000.0
2019-0294-RUS,Russian Federation (the),Eastern Europe,Europe,"Taishetsky, Nizhneudinsky, Tulunsky and Chunsky districts (Irkutsk Oblast; south-east Siberian Federal District)",31.0,190.0,33000.0,,33190.0,,,460000.0
2019-0432-RUS,Russian Federation (the),Eastern Europe,Europe,Primorsky Territory,,,10000.0,,10000.0,,,18000.0
2019-0468-RUS,Russian Federation (the),Eastern Europe,Europe,"Khabarovsk territory, Amur region (Far East Federal district); Irkutsk region (Siberia district)",,,7000.0,,7000.0,,,8000.0
2019-0033-SAU,Saudi Arabia,Western Asia,Asia,Tabouk,12.0,,271.0,,271.0,,,
2019-0252-SAU,Saudi Arabia,Western Asia,Asia,Taif (Meccah province),1.0,,36.0,,36.0,,,
2019-0392-SDN,Sudan (the),Northern Africa,Africa,"While Nile, Kassala, Khartoum, Gazeera, North Kordofan",78.0,,346300.0,,346300.0,,,
2019-0280-SDN,Sudan (the),Northern Africa,Africa,North and South Darfur,,,6198.0,,6198.0,,,
2019-0389-SLE,Sierra Leone,Western Africa,Africa,Freetown,,,5381.0,,5381.0,,,
2019-0338-SLV,El Salvador,Central America,Americas,"Santa Ana, Ahuachapán, Sonsonate, Cabañas departments",5.0,16573.0,,,16573.0,,,
2019-0500-SOM,Somalia,Eastern Africa,Africa,"Hirshabelle, Jubaland, South West, Banadir, Hiran, Gedo",17.0,,500000.0,,500000.0,,,
2019-0396-SVK,Slovakia,Eastern Europe,Europe,Tatra moutains,1.0,,,,,,,
2019-0137-SYR,Syrian Arab Republic,Western Asia,Asia,"Idleb, Al Hasakeh Governate",2.0,,235000.0,,235000.0,,,
2019-0415-TCD,Chad,Middle Africa,Africa,Sila Region (eastern Chad),,,423.0,,423.0,,,
2019-0009-THA,Thailand,South-Eastern Asia,Asia,"Nakhon Si Thammarat, Surat Thani provinces",7.0,,720885.0,,720885.0,,,
2019-9359-THA,Thailand,South-Eastern Asia,Asia,"North, Northeastern, Central Plains",,,,,,,,
2019-0419-THA,Thailand,South-Eastern Asia,Asia,"Amnat Charoen, Khon Kaen, Petchaboon, Phitsanulok, Pichit, Roi-Et, Sri Saket, Sukhothai, Ubon Ratchathani and Yasothorn",19.0,,158000.0,,158000.0,,,
2015-0620-VNM,Viet Nam,South-Eastern Asia,Asia,"Da Nang, Quang Nam (Duy Xuyen, Nong Son districts), Quand Ngai (Ly Son District), Thanh Hoa",11.0,,,,,,,12800.0
2016-0573-VNM,Viet Nam,South-Eastern Asia,Asia,"Thanh Hóa, Lào Cai, Yên Bái, Bac Kan, Dien Bien, Ha Thin, Son La, Thai Nguyen",8.0,4.0,410.0,95.0,509.0,,,
2016-0521-USA,United States of America (the),Northern America,Americas,"Northern (Missouri, Maryland, Oklahoma, Indiana, Michigan, New Mexico, Ohio, Virginia)",22.0,,,,,,,100000.0
2016-0523-ZWE,Zimbabwe,Eastern Africa,Africa,"Mangwe, Bulilima, Guruve, Nkayi",31.0,,2000.0,,2000.0,,,
2016-0550-USA,United States of America (the),Northern America,Americas,"Texas, Oklahoma, Kansas, Missouri, Nebraska, Illinois, Indiana, Kentucky, Ohio",6.0,19.0,,,19.0,,800000.0,
2016-0552-USA,United States of America (the),Northern America,Americas,"Texas, Louisiana (Shreveport, Haugton), Arkansas, Mississipi",5.0,,,,,,333000.0,2300000.0
2016-0522-VEN,Venezuela (Bolivarian Republic of),South America,Americas,"Miranda, Nueva Esparta, Monagas provinces",,,,,,,,
2016-0528-VUT,Vanuatu,Melanesia,Oceania,"Efate, Urban Port vila; Sola (Torba); Luganville (Sanma); Emae (Shefa); Norsup (Malampa province); Lenakel (Tanna, Tafea province)",,351.0,,,351.0,,,
2016-0575-SSD,South Sudan,Northern Africa,Africa,Al Wahdah state,15.0,,,,,,,
2017-0251-TJK,Tajikistan,Central Asia,Asia,"Amondara village, Panjakent district (Sughd Province)",,,700.0,,700.0,,,
2017-0039-USA,United States of America (the),Northern America,Americas,"California, Nevada, Idaho, Colorado, Utah, Oregon states",3.0,,,,,,200000.0,400000.0
2017-0383-VIR,Virgin Island (U.S.),Caribbean,Americas,"St Thomas, St John, St Croix, Water Island (St Thomas), Estate Frenchman's Bay",3.0,,,,,,,
2017-0136-USA,United States of America (the),Northern America,Americas,"East and West Canton (Van Zandt county) (Texas); Kampville (St Charles) (Missouri); Logan, Marion, Miles Station (Macoupin), Sumner (Lawrence), Pawnee (Sangamon) (Illinois); Natural Dam (Crawford), Mississipi, Clay (Arkansas); Oak ridge (Morehouse) (Louisiana) ; Labette (Kansas); Cameron (Le Flore) (Oklahoma); Goshen (Oldham) (Kentucky) ; Ohio; Pennsylvania; West Virginia ; Mississipi ; Alabama ; Tennesse ; Indiana",20.0,70.0,,,70.0,,800000.0,1700000.0
2017-0336-USA,United States of America (the),Northern America,Americas,"Tulsa (Oklahoma); Texas, Louisiana, Kansas, Missouri",,30.0,600.0,,630.0,,200000.0,200000.0
2017-0010-UKR,Ukraine,Eastern Europe,Europe,Eastern Ukraine,37.0,,,,,,,
2017-0542-USA,United States of America (the),Northern America,Americas,"Georgia, North Carolina, Maryland, Virginia, New York, New Jersey, Massachusetts, Michigan, Texas, Mississippi, Missouri",22.0,,,,,,750000.0,1100000.0
2017-0178-ZAF,South Africa,Southern Africa,Africa,"Kraaifontein, Lavender Hill, Strand, Kalkfontein, Delft, Mfuleni, Mandalay, Hout Bay, Kraaifontein (Cape Town), Rheenendal, Welbedacht, Knysna, Pacaltsdorp, Mossel Bay, George to Plettenberg bay (Eden), Welbedacht (Cape Winelands)",9.0,,6918.0,,6918.0,,145000.0,283000.0
2017-0062-USA,United States of America (the),Northern America,Americas,"Center and south of California (San Diego, Los Angeles, San Francisco, Sacramento)",5.0,,200000.0,,200000.0,,200000.0,1500000.0
2017-0091-ZWE,Zimbabwe,Eastern Africa,Africa,"Chitungwiza (Harare), Makoni, Nyanga (Manicaland), Bindura, Centenary, Mazowe, Rushinga, Shamva, Mbire (Mashonaland Central), Goromonzi, Hwedza, Mudzi, Murehwa, Seke, Uzumba-Maramba-Pfungwe, Chikomba (Mashonaland East), Chegutu, Kadoma, Makonde, Kariba (Mashonaland West), Gutu, Zaka, Chiredzi, Mwenezi, Chivi (Masvingo), Tsholotsho, Bubi, Chipinge, Umguza (Matabeleland North), Matobo, Bulilima, Gwanda, Mangwe, Insiza (Matabeleland South), Chirumhanzu, Gweru, Kwekwe, Shurugwi, Zvishavane, Gokwe, Mberengwa (Midlands)",251.0,128.0,100000.0,12895.0,113023.0,,,189000.0
2017-0566-TUR,Turkey,Western Asia,Asia,Istanbul,,,270.0,,270.0,,300000.0,600000.0
2017-0234-USA,United States of America (the),Northern America,Americas,"Colorado, Kansas, Illinois, Indiana, Texas (Gregg County, Tenneryville, Easton, Longview City), Oklahoma (Okfuskee), Missouri (Bates, Carthage, Laclede, Pulaski, Phelps, Dent, Texas Counties, Crawfordsville, Phillipsburg, Edgar Springs, Salem, Evening Shade, Palace, Big Piney), Arkansas, Ohio, Kentucky, Tennessee (Millington, Memphis, Knoxville), Virginia, Louisiana (Natchitoches, DeSoto, Caddo, Caldwell, Franklin, LaSalle, Winn, Rapides, Catahoula, Concordia Parishes, Goldonna), North Dakota, South Dakota, Minnesota, Iowa, Ohio, Pennsylvania, New York, North Carolina (Sampson County, Salemburg, Clinton), South Carolina, Georgia, New Mexico",,,,,,,1100000.0,1400000.0
2017-0564-USA,United States of America (the),Northern America,Americas,"Texas (Justin in Denton, Collin, Rockwall, Lubbock counties, Seymour in Baylor, Dallas – Fort Worth metro area, Houston metro area), Oklahoma (El Reno in Canadian, Oklahoma city metro region, Caddo in Bryan, Cleveland South and East), Kansas (south), Kentucky, Tennessee, Mississippi, Alabama, Georgia, Indianapolis (Marion-IN)",1.0,,,,,,2000000.0,2700000.0
2017-0362-USA,United States of America (the),Northern America,Americas,"Eastern Texas (Rockport, Corpus Chrsti, Port Lavaca, Cypress area of Houston, Houston metro area, Beaumont, Port Arthur, Angelina, Aransas, Atascosa, Austin, Bastrop, Bee, Bexar, Brazoria, Brazos, Burleson, Caldwell, Calhoun, Cameron, Chambers, Colorado, Comal, DeWitt, Fayette, Fort Bend, Galveston, Goliad, Gonzales, Grimes, Guadalupe, Hardin, Harris, Jackson, Jasper, Jefferson, Jim Wells, Karnes, Kerr, Kleberg, Lavaca, Lee, Leon, Liberty, Live Oak, Madison, Matagorda, Montgomery, Newton, Nueces, Orange, Polk, Refugio, Sabine, San Jacinto, San Patricio, Trinity, Tyler, Victoria, Walker, Waller, Washington, Wharton, Willacy, Wilson, San Augustine), Southwestern Louisiana (Acadia, Forrest, Iberia, Lafayette, Vernon, Beauregard, Calcasieu, Cameron (Hackberry), Jefferson Davis, Vermillion, Allen, Natchitoches, Rapides, Sabine)",88.0,24.0,555000.0,27000.0,582024.0,,30000000.0,95000000.0
2017-0070-USA,United States of America (the),Northern America,Americas,"Illinois, Missouri, Indiana, Arkansas, Kentucky, Tennessee, Ohio , Georgia, Iowa, North Carolina, Virginia, Alabama, South Carolina, West Virginia, Michigan states",4.0,12.0,600.0,,612.0,,1400000.0,1900000.0
2017-0169-TWN,Taiwan (Province of China),Eastern Asia,Asia,"New Taipei City (Bali, Shimen Districts), Yunlin County, Taichung City, Changhua County, Nantou County, and Chiayi County; Kaohsiung City, Nantou County, Chiayi County, Tainan City",5.0,35.0,4000.0,39.0,4074.0,,,28100.0
2017-0337-VNM,Viet Nam,South-Eastern Asia,Asia,"Yen Bai (Mu Cang Chai district), Son La (Muong La), Bac Kan, Lai Chau (Nam-Ho Dien Bien district), Dien Bien",39.0,21.0,3000.0,1140.0,4161.0,,,88000.0
2017-0259-VNM,Viet Nam,South-Eastern Asia,Asia,"Ha Giang, Lao Cai, Dien Bien, Yen Bai (Mu Cang Chai district), Tuyen Quang, Thai Nguyen, Lai Chau, Bac Kan, Cao Bang (Hoa An district), Binh Thuan, An Giang, Cà Mau (Nam Can, Ngoc Hien and Dam Doi districts) Provinces",1.0,4.0,4100.0,,4104.0,,,355.0
2017-0270-VNM,Viet Nam,South-Eastern Asia,Asia,"Thai Nguyen, Ha Giang, Dien Bien, Hoa Binh, Cao Bang",14.0,,400.0,,400.0,,,1300.0
2017-0428-VNM,Viet Nam,South-Eastern Asia,Asia,"Thanh Hoa, Nghe An, Ha Tinh, Hoa Binh, Yen Bai (V?n Tr?n, Tr?m T?u districts, Ngh?a L? Town), Son La, Quang Tri, Ha Noi (Nam Hai, Chong My), Phu Tho, Ha Nam",75.0,38.0,40000.0,,40038.0,,,88000.0
2017-0280-TUR,Turkey,Western Asia,Asia,Bodrum,,360.0,,,360.0,,,
2017-0203-USA,United States of America (the),Northern America,Americas,"Colorado, New Mexico, Texas, Oklahoma, Missouri",,,,,,,2500000.0,3100000.0
2017-0563-USA,United States of America (the),Northern America,Americas,"Missouri (Oak Grove in Jackson County, Clay and Clinton (Trimble, Plattsburg, Lathrop) counties), Iowa (Centerville in Appanoose county, Muscatine), Minnesota (Sherburne, Freeborn counties, Lake Ann in Carver county), Kansas (Wabaunsee, Pottawatomie and Butler counties), Wisconsin, Arkansas, Oklahoma, Illinois, Mississipi, Michigan, New-York, Pennsylvania, Massachussets, Ohio, Nebraska, Indiana",2.0,15.0,600.0,,615.0,,2000000.0,2200000.0
2017-0253-USA,United States of America (the),Northern America,Americas,"Minnesota (Minneapolis – St. Paul, MN metro region-Twin Cities, Lac Qui Parle County, Montevideo (Chippewa), Slayton (Murray), St. Cloud (Stearns), Monticello (Wright), Coon Rapids (Anoka)), Wisconsin (St. Croix), Upper Peninsula (Michigan), North Dakota (Richardson, Stark County, Morton County, Milton and Langdon in Cavalier County), South Dakota (Deuel, Jerauld, Beadle, and Clark Counties)",,2.0,,,2.0,,1500000.0,2000000.0
2017-0512-USA,United States of America (the),Northern America,Americas,"Missouri, Indiana (Bedford in Lawrence, Muncie in Delaware, Salem in Washington, Blackford, Jay), Ohio (Celina in Mercer, Williamsfield in Ashtabula, Clyde in Sandusky, Bloomingville in Erie , Republic, West Lodi in Seneca, Galion in Crawford, Steuben, Norwalk, Fitchville, Wakeman in Huron, Nova and Hayesville in Ashland, South Vienna in Wayne, Calcutta in Columbiana, Clark), Pennsylvania (Erie in Erie), Illinois (Noble in Richland)",,8.0,,,8.0,,200000.0,260000.0
2017-0329-TUN,Tunisia,Northern Africa,Africa,"Jendouba Governorate (Ain Draham, Fernana), Bizerte (Sejnane and Ghezala)",,,2000.0,,2000.0,,,
2017-0326-TWN,Taiwan (Province of China),Eastern Asia,Asia,"Kaohsiung City, New Taipei City",1.0,131.0,,,131.0,,,17200.0
2017-0381-USA,United States of America (the),Northern America,Americas,"Keys islands, Monroe, South Florida, Jacksonville (Duval), Marco Island, Naples (Collier), Fort Lauderdale (Broward), Lakeland (Polk), Orlando (Orange), Clay (Florida), Savannah, Tybee Island (Chatham), Brunswick, St. Simons Island (Glynn), McIntosh, Camden (Georgia), Charleston, Folly Beach, the Isle of Palms, Sullivan’s Island (Charleston) Hilton Head, Beaufort, Edisto Beach (Colleton) (South Carolina)",97.0,,,70000.0,70000.0,,29000000.0,57000000.0
2017-0381-VIR,Virgin Island (U.S.),Caribbean,Americas,"St. John, St. Thomas, most of St. Croix",4.0,,,,,,,
2017-0422-VNM,Viet Nam,South-Eastern Asia,Asia,"Khanh Hoa, Phu Yên, Binh Dinh, Dak Lak, Gia Lai, Dak Nông, Lâm Dông, Quang Nam, Quang Ngai, Kon Tum",123.0,,4330000.0,,4330000.0,,,1000000.0
2017-0462-ZAF,South Africa,Southern Africa,Africa,"Durban (Bluff, Jacobs, Montclair, Glenwood, Umlazi, Merebank, Isipingo), Johannesburg, Ekurhuleni (East Rand), West Rand District Municipality (Orient Hills, Krugersdorp), Nquthu (Umzinyathi)",11.0,18.0,,500.0,518.0,,140000.0,320000.0
2017-0381-BLM,Saint Barthélemy,Caribbean,Americas,,4.0,,,,,,1048800.0,
2017-0010-SRB,Serbia,Southern Europe,Europe,Belgrade,6.0,,,,,,,
2017-0205-TZA,"Tanzania, United Republic of",Eastern Africa,Africa,Tanga,7.0,,,,,194000.0,,
2017-0395-UGA,Uganda,Eastern Africa,Africa,"Rubanda district, Nfasha, Rukungiri district",17.0,14.0,,,14.0,,,
2017-0447-UGA,Uganda,Eastern Africa,Africa,"Kween, Kapachorwa, Bukwo districts",3.0,,,,,,,
2017-0195-URY,Uruguay,South America,Americas,"Salto, Paysandú, Artigas, Río Negro",,,6639.0,,6639.0,,,
2017-0108-USA,United States of America (the),Northern America,Americas,"South Carolina, Georgia, North Carolina, Tennessee, Alabama, Mssissippi, Florida, Kentucky , Virginia",11.0,12.0,,,12.0,,,1000000.0
2017-0022-USA,United States of America (the),Northern America,Americas,"Georgia (cook), Mississippi, Alabama, Louisiana, Florida states",24.0,200.0,,,200.0,,800000.0,1100000.0
2017-0282-USA,United States of America (the),Northern America,Americas,"Ellison Creek (Water wheel) Tonto National Forest (Gila, Arizona)",10.0,,,,,,,
2017-0058-USA,United States of America (the),Northern America,Americas,San Jose (North California),,,300.0,,300.0,,,
2017-0383-USA,United States of America (the),Northern America,Americas,"Jersey shore, Seaside Park, Point Pleasant Beach (Ocean), Long Branch (Monmouth) (New Jersey), Fernandina beach (Nassau-Florida)",4.0,,,,,,,
2017-0410-USA,United States of America (the),Northern America,Americas,"Mexico Gulf, Louisiania, Mississippi (coastal areas, Biloxi), Alabama (Dauphin Island, Autauga, Chilton, Lowndes Counties), Florida, South Carolina (Pickens, Laurens, Spartanburg, Newberry, Greenville, Union), North Carolina (Polk, Wilkes, Ashe )",,,60.0,,60.0,,,250000.0
2017-0252-USA,United States of America (the),Northern America,Americas,"Butte (Oroville), San Luis Obispo, Santa Barbara (California)",,,9.0,147.0,156.0,,,
2017-0434-USA,United States of America (the),Northern America,Americas,"Napa, Sonoma, Mendocino, Lake, Solano, Butte, Yuba, Nevada, Humboldt, Calavaras, Orange counties (California)",43.0,185.0,,9000.0,9185.0,,9600000.0,13000000.0
2017-9550-USA,United States of America (the),Northern America,Americas,"Upper Midwest, Northern Rockies and parts of the West; North Dakota, South Dakota and Montana.",,,,,,,1900000.0,2500000.0
2017-0511-USA,United States of America (the),Northern America,Americas,"Ventura, Santa Barbara, Los Angeles, San Diego, Riverside counties (California)",2.0,2.0,,2961.0,2963.0,,1700000.0,2200000.0
2017-0381-VGB,Virgin Island (British),Caribbean,Americas,"Anagoda, Tortola, Necker Island (Virgin Gorda)",9.0,,,,,,,3000000.0
2017-0383-VGB,Virgin Island (British),Caribbean,Americas,,,,,,,,,
2017-0281-VNM,Viet Nam,South-Eastern Asia,Asia,"Thanh Hoa, Nghe An (Hon Ngu beach, Cua Lo district), Ha Tinh, Ha Noi city (Nhà Xanh Market in Câu Giây District)",9.0,,21000.0,,21000.0,,,71000.0
2017-0352-VNM,Viet Nam,South-Eastern Asia,Asia,Lao Cai (Sa Pa district),1.0,1.0,,,1.0,,,1430000.0
2017-0406-VNM,Viet Nam,South-Eastern Asia,Asia,"Nghe An, Ha Tinh, Thanh Hoa, Quang Binh, Quang Tri, Thua Thien-Hue, Hoa Binh",14.0,112.0,691900.0,,692012.0,,,484000.0
2017-0492-VNM,Viet Nam,South-Eastern Asia,Asia,"Quang Tri, Thua Thien-Hue, Da Nang, Quang Nam, Quang Ngai, Binh Dinh",8.0,,41500.0,,41500.0,,,
2017-0394-VUT,Vanuatu,Melanesia,Oceania,"Ambae, Ni-Vanuatu island",,,11000.0,,11000.0,,,
2017-0231-VUT,Vanuatu,Melanesia,Oceania,"Torba, Malampa, Sanma provinces",,,2564.0,,2564.0,,,
2017-0279-YEM,Yemen,Western Asia,Asia,Sanaa,,,,,,,,
2017-0555-YEM,Yemen,Western Asia,Asia,Sanaa,35.0,298.0,,,298.0,,,
2017-0365-YEM,Yemen,Western Asia,Asia,"Taëz, Lahj provinces, Portions of Jibla (south of Ibb), Taizz city, Ibb city",50.0,8.0,,,8.0,,,
2017-9211-ZAF,South Africa,Southern Africa,Africa,"Cap town, Cap occidental, Cap oriental, North Cap.",,,,,,,,1200000.0
2017-0217-ZAF,South Africa,Southern Africa,Africa,"KwaZulu-Natal, Nquthu (Umzinyathi District), Zinkwazi (Ilembe District), Mzingwenya (Uthungulu District), uMzumbe municipality, uMdoni, uMuziwabantu (Ugu)",3.0,,200.0,,200.0,,,
2017-0547-ZAF,South Africa,Southern Africa,Africa,Knysna (Eden),9.0,,,5500.0,5500.0,,200000.0,420000.0
2017-0340-COD,Congo (the Democratic Republic of the),Middle Africa,Africa,Tora (Ituri),174.0,10.0,,,10.0,,,
2017-0543-COD,Congo (the Democratic Republic of the),Middle Africa,Africa,Kinshasa,43.0,1022.0,,,1022.0,,,
2017-0391-COD,Congo (the Democratic Republic of the),Middle Africa,Africa,"Bihambwe, Matanda",105.0,,,500.0,500.0,,,
2017-0558-ZMB,Zambia,Eastern Africa,Africa,"Matero, Chipata, Kanyama (Lusaka",89.0,4371.0,,,4371.0,,,
2017-0297-MNE,Montenegro,Southern Europe,Europe,"Lustica (Tivat), Kotor, Tivat, Herceg Novi",,,200.0,,200.0,,,
2017-0381-MAF,Saint Martin (French Part),Caribbean,Americas,,7.0,,,,,,1231200.0,4100000.0
2017-0381-SXM,Sint Maarten (Dutch part),Caribbean,Americas,,4.0,,,11400.0,11400.0,,500000.0,2500000.0
2018-0227-VNM,Viet Nam,South-Eastern Asia,Asia,Chuong My,34.0,,96000.0,,96000.0,,,220000.0
2018-0305-VNM,Viet Nam,South-Eastern Asia,Asia,"Nghe An,Son La, Thanh Hóa, Yên Bái,Bac Giang provinces",13.0,,50000.0,,50000.0,,,2000.0
2018-0005-COD,Congo (the Democratic Republic of the),Middle Africa,Africa,"Galiema, Bandalungwa, Selembao, Masina, Limete, Kalamu, Bumbu, Kimbaseke Ndjili communes (Kinshasa)",51.0,17.0,,15743.0,15760.0,,,
2018-0111-USA,United States of America (the),Northern America,Americas,"Massachusetts, New York, Virginia, Maryland, New Hampshire, New Jersey, Pennsylvania, Connecticut, Delaware",9.0,,,,,,1400000.0,2300000.0
2018-0395-TTO,Trinidad and Tobago,Caribbean,Americas,"Sangre Grande, Tunapuna/Piarco, Couva/Tabaquite/Talparo, Mayaro/Rio Claro regions",,,150000.0,,150000.0,,,3700.0
2018-0130-USA,United States of America (the),Northern America,Americas,Kauai Isl. (Hawai),,,1596.0,,1596.0,,,125000.0
2018-0204-VNM,Viet Nam,South-Eastern Asia,Asia,Lai Chau,33.0,18.0,16710.0,,16728.0,,,23000.0
2018-0369-VNM,Viet Nam,South-Eastern Asia,Asia,Northern provinces,20.0,,6000.0,,6000.0,,,
2018-0146-USA,United States of America (the),Northern America,Americas,Hawaï,,,2500.0,,2500.0,,,500000.0
2018-0456-VUT,Vanuatu,Melanesia,Oceania,Malampa province,,,7286.0,,7286.0,,,
2018-0258-USA,United States of America (the),Northern America,Americas,"Shasta, Trinity, Mendocino, Lake, Colusa, and Glenn counties (California)",14.0,,,3237.0,3237.0,,,1000000.0
2018-0344-USA,United States of America (the),Northern America,Americas,"Colorado, Nebraska, Wyoming",,18.0,,,18.0,,615000.0,1000000.0
2018-0129-USA,United States of America (the),Northern America,Americas,"Louisiana, Mississippi, North Carolina, Virginia, Arkansas, Florida, Georgia, Maryland, Michigan , Missouri , New Jersey, New York,Pennsylvania , South Carolina, Texas",3.0,,,,,,,1300000.0
2018-0419-USA,United States of America (the),Northern America,Americas,"Bastrop, Burnet, Colorado, Fayette, Hood, Jim Wells, Kerr, Kimble, La Salle, Live Oak, Llano, Mason, McMullen, Nueces, Real, San Patricio, Travis, and Williamson counties",5.0,,,,,,,400000.0
2018-0045-USA,United States of America (the),Northern America,Americas,"Massachusetts , New Jersey, New York, Connecticut, Maine, New Hampshire, Pennsylvania, Maryland, Rhode Island , South Carolina, Tennessee, Virginia, North Carolina, Georgia",22.0,,,,,,,1000000.0
2018-0042-TON,Tonga,Polynesia,Oceania,"Tongatapu, Ha’apai and Eua islands",,,87000.0,,87000.0,,,
2018-0313-TWN,Taiwan (Province of China),Eastern Asia,Asia,"Chiayi, Kaohsiung, Tainan counties",7.0,140.0,6000.0,,6140.0,,,34000.0
2018-0423-UGA,Uganda,Eastern Africa,Africa,Bududa district,51.0,,,,,,,
2018-0457-USA,United States of America (the),Northern America,Americas,"New Mexico, Texas, Iowa, Minnesota, Kansas, Louisiana, Tennessee",2.0,,,,,,,150000.0
2018-0342-USA,United States of America (the),Northern America,Americas,"South and North Carolina, Virginia",53.0,,1500000.0,,1500000.0,,5000000.0,14000000.0
2018-0010-USA,United States of America (the),Northern America,Americas,"Santa Barbara County (Montecito and Carpinteria), Los Angeles County (Burbank), Ventura (California)",21.0,28.0,1338.0,,1366.0,,,900000.0
2018-0201-VNM,Viet Nam,South-Eastern Asia,Asia,,1.0,,,,,,,
2018-0042-WSM,Samoa,Polynesia,Oceania,,,,,,,,,
2018-0177-YEM,Yemen,Western Asia,Asia,Socotra Isl.,24.0,,750.0,,750.0,,,
2018-0394-YEM,Yemen,Western Asia,Asia,Al Maharah governorate,25.0,124.0,15000.0,,15124.0,,,
2018-0373-USA,United States of America (the),Northern America,Americas,"Florida, Georgia, Alabama, North Carolina, Virginia, Maryland",49.0,,5000.0,,5000.0,,10000000.0,16000000.0
2018-0272-TUR,Turkey,Western Asia,Asia,Sarilar village (Tekirdag region),24.0,100.0,,,100.0,,,
2018-0279-USA,United States of America (the),Northern America,Americas,"Pella, Marshalltown (Iowa); Missouri , Illinois, Indiana, Kansas, Kentucky, Alabama, Arkansas, Georgia, Tennessee, North Carolina, South Carolina, Viriginia, Maryland , Pennsylvania",,,,,,,400000.0,1500000.0
2018-0246-SRB,Serbia,Southern Europe,Europe,"Vojvodina, Sumadija, Pomoravlje regions",,,231.0,,231.0,,,
2018-0207-TJK,Tajikistan,Central Asia,Asia,"Farkhor, Panj districts (Khatlon Province)",6.0,,5725.0,,5725.0,,,
2018-0364-TUN,Tunisia,Northern Africa,Africa,governorates of Tunis and part of Nabeul,6.0,,30000.0,,30000.0,,,36000.0
2018-0388-TUN,Tunisia,Northern Africa,Africa,"Cap Bon, Kef, Grombalia, Sidi Bouzid, Kasserine, Zaghouan",7.0,,,,,,,
2018-0059-TWN,Taiwan (Province of China),Eastern Asia,Asia,Hualian,84.0,285.0,,,285.0,,,100000.0
2018-0125-TZA,"Tanzania, United Republic of",Eastern Africa,Africa,"Dar es Salaam (Kinondoni, Ilala, Temeke and Kigamboni Municipals); Arusha (Arusha District Council, Meru, Longido, Monduli districts); Zanzibar; Kilimanjaro (Same, Hai, Mwanga districts); Tanga (Handeni, Lushoto districts); Manyara (Simanjiro, Kiteto, Babati districts); Tabora (Nzega and Kaliua districts); Pwani (Mafia and Rufiji districts); Mwanza, Morogoro, Dodoma, Mbeya, Rukwa, Mtwara, Shinyanga, Geita",15.0,11.0,15862.0,,15873.0,,,
2018-0076-UGA,Uganda,Eastern Africa,Africa,Kyangwali refugee camp (Hoima district),31.0,,1000.0,,1000.0,,,
2018-0248-UKR,Ukraine,Eastern Europe,Europe,"Lviv, Chernivtsi, Ivano-Frankivsk",,,600.0,,600.0,,,
2018-9103-URY,Uruguay,South America,Americas,"Tacuarembó, Salto, Durazno, Artigas, Paysandú, Rivera, Río Negro, Florida, Treinta y Tres, Maldonado, Cerro Largo, Colonia",,,11135.0,,11135.0,,,500000.0
2018-0046-USA,United States of America (the),Northern America,Americas,"Colorado, PLains and Midwest",10.0,,,,,,,50000.0
2018-0331-USA,United States of America (the),Northern America,Americas,"Wisconsin, Iowa, Minnesota, Missouri, Illinois, Kentucky, Pennsylvania, Arkansas, Ohio, Indiana",2.0,,,,,,,250000.0
