Dis No,Country,Region,Continent,Location,Total Deaths,No Injured,No Affected,No Homeless,Total Affected,Reconstruction Costs,Insured Damages,Total Damages
2017-0111-IDN,Indonesia,South-Eastern Asia,Asia,"Limapuluh Koto Regency (Sumatra province), Pangkalan, Kapur IX, Lareh Sago Halaban, Harau districts",8.0,,17410.0,,17410.0,,,19000.0
2017-0068-IDN,Indonesia,South-Eastern Asia,Asia,"Kintamani district (Bali); Java, Lombok, and Sumbawa.",12.0,,50500.0,,50500.0,,,2000.0
2017-0494-IDN,Indonesia,South-Eastern Asia,Asia,"Aceh Singkil district, Asahan Regency, Bandung Regency, Balangan Regency, Medan City, Pelalawan Regency, South Ogan Komering Ulu Regency, Tegal Regency",9.0,,12000.0,,12000.0,,,
2017-0096-IRN,Iran (Islamic Republic of),Southern Asia,Asia,"Azerbaijane-Gharbi (west), Azerbaijane-Sharghi (east), Kordestan, Zanjan, Mazandaran, Ardebil",42.0,,,,,,,353000.0
2017-0246-JPN,Japan,Eastern Asia,Asia,"Fukuoka (Asakura), Oita prefectures (Kyushu Isl.), Shimane, Kunamoto, Hiroshima, Nagasaki, Miyazaki, Kagoshima",37.0,34.0,2610.0,300.0,2944.0,,140000.0,700000.0
2017-0153-LKA,Sri Lanka,Southern Asia,Asia,"Ratnapura, Matara, Kalutara, Galle, Gampaha, Colombo, Sabaragamuwa, Hambantota",293.0,154.0,879778.0,,879932.0,,33000.0,389000.0
2017-0311-MMR,Myanmar,South-Eastern Asia,Asia,"Magway, Sagaing, Bago (Bago-Kyaukkyi, Tharyarwady Townships), Ayeyarwady (Danubya, Myanaung, Ingapu Townships), Mon State (Kyaikto Township-Kawsannaing, Zayarmon, Northern Wards and Lone Pakkalate Village, Theinzayet Village, Seikkanthar Ward), Mandalay Region (Union Territory-Yamethin), Chin, Kayin, Rakhine (Ann, Taungup Townships) and Shan states, Kachin",3.0,,92000.0,,92000.0,,,
2017-0383-MTQ,Martinique,Caribbean,Americas,"Le Morne-rouge, Le Carbet (St Pierre), Le Marigot, Gros-Morne (La Trinité), Northern coast, Fort-de-France, Schoelcher (Fort de France)",,2.0,,,2.0,,,44000.0
2017-0321-NPL,Nepal,Southern Asia,Asia,"Kaski, Syangja (Gandaki), Mugu (Karnali), Sindhuli, Dudhauli (Janakpur), Saptari, Tilathi (Sagarmatha) districts, Parbat district (Daulagiri), Myanglung,Terhathum district (Koshi), Pyuthan district (Rapti)",11.0,,6000.0,,6000.0,,,
2017-0342-NPL,Nepal,Southern Asia,Asia,"Lalitpur, Palpa, Jhapa, Morang, Sunsari, Saptari, Bardia, Dang,Banke, Sirha, Sarlai, Bara, Sindhuli, Panchhthar, Rasuwa, Rupendehi, Baglung, Nawalparasi, Kailali, Kalikot, Doti, Dhading, Ramechhap, Syangia, Parbat, Pyuthan, Kaski, Terathum, Dolakha districts",176.0,134.0,1700000.0,,1700134.0,,,595000.0
2017-0222-NZL,New Zealand,Australia and New Zealand,Oceania,"North Coast, North Island. From Auckland to Wellington, Titirangi, Kohimarama , Manawatu-Wanganui Region, Whanganui, Rangitikei, Whakat?ne districts, Bay of Plenty, Edgecumbe city, Minginui, Ruat?huna, Te Wh?iti and R??toki communities",,,2200.0,,2200.0,,65000.0,71000.0
2017-0243-PAK,Pakistan,Southern Asia,Asia,"Tehsil Hub, Jangi village, Lasbela district, Dera Bugti district, Chagai, Kalat, Bolan, Kholu districts (Balouchistan province), Sindh (Karachi), Jhang, Rawalpindi (Punjab), Azad Jammu & Kashmir, Shareeb Khana (Bajaur) in the Federally Administered Tribal Areas, Chitral (Khyber Pakhtunkhwa)",167.0,167.0,2200.0,,2367.0,,,110000.0
2017-0410-PAN,Panama,Central America,Americas,"Ngäbe-Buglé, Veraguas and Chiriqui, Panama Bay, Panama West, Cerro Hacha",7.0,,12000.0,,12000.0,,,
2017-0036-PER,Peru,South America,Americas,"Arequipa, Camana, Caraveli, Castile, Caylloma, Condesuyos, Islay, La Union (Arequipa). Huancavelica, Acobamba, Angaraes, Castrovirreyna, Huaytara, Tayacaja (Huancavelica), Ica, Nasca, Palpa, Pisco (Ica), Canete, Canta, Huarochirir, Lima, Oyon, Yauyos (Lima)",15.0,,376000.0,,376000.0,,,100000.0
2017-0084-PER,Peru,South America,Americas,"Ancash department (Huarmey, Casma, El Santa provinces); Tumbes department (Zarumilla and Tumbes provinces); Lima department (Lima, Huarochirí and Canta provinces), La Libertad department (Trujillo province), Chiclayo department (Chiclayo province), Piura department (Piura province)",184.0,505.0,1800000.0,,1800505.0,,380000.0,3100000.0
2017-0140-PHL,Philippines (the),South-Eastern Asia,Asia,"Verde Island Passage (Tingloy, Maricaban Island). Batangas and Laguna provinces",,,25000.0,,25000.0,,,2000.0
2017-0028-PHL,Philippines (the),South-Eastern Asia,Asia,"Western Visayas, Central Visayas, Eastern Visayas, Zamboanga (Samboanga del Norte), Northern Mindanao (Bukidnon, Camiguin, Misamis Occidental, Misamis oriental, Lanao del Norte) Davao (Compostela, Davao del Norte, Davao del Sur, Davao Oriental), Caragan (Agusan del Norte, Agusan del Sur, Surigao del Norte), Autonomous region of Muslim Mindanao (Lanao del Sur, Maguindanao), Soccskargen (Saranggani)",9.0,,1500000.0,,1500000.0,,,8100.0
2017-0343-SLE,Sierra Leone,Western Africa,Africa,"Freetown, Regent neighbourhood, Juba/Kaningo, Malama/Kamayama",1102.0,100.0,11816.0,,11916.0,,,30000.0
2017-0410-SLV,El Salvador,Central America,Americas,"Chalatenango, La Libertad",10.0,4.0,530.0,50.0,584.0,,,
2017-0316-THA,Thailand,South-Eastern Asia,Asia,"Sakon Nakhon, Nakhon Sawan, Lop Buri, Chai Nat, Chanthaburi, Phichit, Phetchabun, Phrae (Den Chai, Song), Uttaradit, Chumphon, Kamphaeng Phet, Nan, Chiang Rai, Chiang Mai, Phayao, Ang Thong, Ranong, Lampang, Nan Yasothan (Pa Tiu), Ayutthaya, Trat, Ubon Ratchathani (Si Muang Mai, Kong Chiam, Nam Yuen), Kalasin, Nakhon Phanom, Chai Nat (Manorom, Han Ka, and Nern Kham)",23.0,,1000000.0,,1000000.0,,31000.0,307000.0
2017-0280-GRC,Greece,Southern Europe,Europe,Kos Island,2.0,120.0,,,120.0,,,
2017-0449-HND,Honduras,Central America,Americas,"Francisco Morazán, Olancho, Colón, Cortés (La Lima), Atlántida, Islas de La Bahía, Santa Bárbara, El Paraíso, Yoro, Gracias a Dios",8.0,,46975.0,,46975.0,,,
2017-0481-TGO,Togo,Western Africa,Africa,"Nangbeto (Ogou) Agbanakin, Atchamé, Togbavi, Togbagan, Azimé-Dossou, Adamé, Gbandi, Gbandidi, Agbetiko, Handivi villages",,,16060.0,,16060.0,,,
2017-0465-THA,Thailand,South-Eastern Asia,Asia,"Central plains provinces- Bangkok, Chai Nat, Pathum Thani, Lop Buri, Kamphaeng Phet, Sing Buri, Ang Thong, Ayutthaya, Nakhon Sawan, Tak, and Pichit, Khon Kaen, Sukhothai, Uthai Thani, Suphan Buri, Nong Bua Lam Phu, Maha Sarakham, Kalasin, Roi Et, Ubon Ratchathani provinces",9.0,,605000.0,,605000.0,,,1400.0
2017-0151-RUS,Russian Federation (the),Eastern Europe,Europe,Moscow city and greater Moscow region,16.0,201.0,,,201.0,,,2000.0
2017-0228-ESP,Spain,Southern Europe,Europe,"Near Moguer and Mazagon (Huelva province), Andalousia, Donana National park",,,1500.0,,1500.0,,,
2017-0383-GLP,Guadeloupe,Caribbean,Americas,La Desirade Island,4.0,2.0,80000.0,,80002.0,,,120000.0
2017-0352-HKG,Hong Kong,Eastern Asia,Asia,"Tai O, on Lantau Island",,129.0,27.0,,156.0,,,755500.0
2017-0408-HRV,Croatia,Southern Europe,Europe,"Zadar region, Bibinje, Sukošan, Biograd na Moru, Nin",,,3500.0,,3500.0,,6000.0,161000.0
2017-0381-HTI,Haiti,Caribbean,Americas,"Caracol (Trou du Nord), Feroer, Malfety (Fort Liberte), Ouanaminthe, Cap Haitien; Port de Paix, St. Louis de Nord, Anse-a-Foleur, Jean Rabel, Baie-de-Henne, Detipotpe, Ile de la Tortue, Bassin Blue, Chansolme, Mole St. Nicolas which were supported",1.0,17.0,40075.0,,40092.0,,162.0,
2017-0230-HUN,Hungary,Eastern Europe,Europe,Megyaszó (Borsod-Abaúj-Zemplén county) and Kecskemét area (Bács-Kiskun County),,,1298.0,,1298.0,,,
2017-0508-IND,India,Southern Asia,Asia,"Kerala (Thiruvananthapuram, Kozhikode,Ernakulam),Tamil Nadu (Kanyakumari-Munchirai, Thiruvattar,Killiyur, Kurunthancode, Rajakkamangalam-, Tirunelveli, Tuticorin districts), Andhra Pradesh (Chittoor and Nellore), Lakshadweep Islands",884.0,,60000.0,,60000.0,,,
2017-0352-MAC,Macao,Eastern Asia,Asia,Fai Chi Kei,10.0,200.0,,,200.0,,,1420000.0
2017-0075-MDG,Madagascar,Eastern Africa,Africa,"Antalaha district (Sava province), Analanjirofo, Alaotra Mangoro, Atsinanana, Analamanga, Vakinankaratra, Bongolava, Itasy, Ihorombe, Amoron I Mania, Haute Matsiatra, Vatovavy Fitovinany provinces",81.0,253.0,434000.0,,434253.0,,,20000.0
2017-0376-MEX,Mexico,Central America,Americas,"Cabo San Lucas, San Jose del Cabo (Baja California Sur), Comondu, Mulege, La Paz, Los Cabos, Loreto",20.0,,,1000.0,1000.0,,,
2017-0051-MOZ,Mozambique,Eastern Africa,Africa,"Vilankulo, Massinga, Maxixe, Jangamo, Morrumbene Inhambane City, Funhalouro, Homoine, Jangamo, Inharrime, Panda, Zavala (Inhambane province); Chibuto, Guja, Chokwe distrcits (Gaza province)",7.0,102.0,750000.0,,750102.0,,,17000.0
2017-0380-MRT,Mauritania,Western Africa,Africa,"Boghé, Brakna region, Kiffa, Assaba region",18.0,40.0,2000.0,,2040.0,,,
2017-0256-NPL,Nepal,Southern Asia,Asia,"Parbat, Kaski, Pyuthan, Syangja, Saptari, Mugu, Sindhuli districts (Paunwatole Rayapur of Rupani Rural Municipality)",11.0,,7500.0,,7500.0,,,
2017-0381-PRI,Puerto Rico,Caribbean,Americas,North. Culebra and Vieques Islands,2.0,,,,,,,
2017-0415-RWA,Rwanda,Eastern Africa,Africa,"Rusizi, Nyamasheke, Huye, Bugesera, Gicumbi, Ngoma, Kirehe, Rubavu, Nyabihu",3.0,24.0,5850.0,,5874.0,,,
2017-0381-TCA,Turks and Caicos Islands (the),Caribbean,Americas,"South Caicos, Salt Cay, Grand Turks, Provo (Five keys)",,,,,,,14900.0,500000.0
2017-0406-THA,Thailand,South-Eastern Asia,Asia,"Uthai Thani, Phitsanulok, Phrae, Chaiyaphum, Chiang Rai, Kalasin, Lampang, Loei, Phangnga, Phetchabun, Sakon Nakhon, Satun, Uttaradit",,,28500.0,,28500.0,,,
2017-9343-MRT,Mauritania,Western Africa,Africa,"Brakna, Gorgol, Guidimakha",,,3893774.0,,3893774.0,,,
2017-9208-NER,Niger (the),Western Africa,Africa,"Bosso, Diffa, Goudoumaria, Mainé-Soroa, N’Gourti, Loga, Ouallam, Bani-Bangou, Abala, Mayahi, Guidan-Roumji, Tanout, Kaniche",,,1131300.0,,1131300.0,,,
2017-9342-TCD,Chad,Middle Africa,Africa,"Chari Baguimi, Guera, Lac, Kanem, Wadi Fira",,,1886800.0,,1886800.0,,,
2017-0015-ITA,Italy,Southern Europe,Europe,"Avezzano, Campotosto, Montereale, Capitignano, Ortolano di Campoposto, Mopolino (L’Aquila); Csatel Castagna, Csatigkione Messer Raimondo, Prati di Tivo (Teramao); Abruzzo (Pescara), Lazio (Rieti), Marche (Ascoli Piceno, Macerata, Fermo, Ancona) region",29.0,11.0,,,11.0,,6000.0,18000.0
2017-0010-GRC,Greece,Southern Europe,Europe,Aegean Islands,,,,,,,,
2017-0010-MKD,Macedonia (the former Yugoslav Republic of),Southern Europe,Europe,"Skopje, Negotino, Kavadarci, Kumanovo, Bitola, Gostivar, Kriva Palanka, Debar, Sveti Nikole, Struga, Stip, Ohrid provinces, Makedonski Brod district (Brod province), Kivecho (?)",3.0,,2220.0,,2220.0,,,
2017-0417-ESP,Spain,Southern Europe,Europe,"Galicia (Nigrán, Carballeda de Avia, Vigo), Asturias",4.0,,,,,,,
2017-0320-FRA,France,Western Europe,Europe,Haute-Loire Department (Le Brignon),1.0,,160.0,,160.0,,,
2017-0086-FRA,France,Western Europe,Europe,"Brittany, Provence, Sud Ouest (Brive), Alpes du Sud, Centre et Sud-Est.",2.0,11.0,,,11.0,,341000.0,100000.0
2017-0292-FRA,France,Western Europe,Europe,"Near Bormes-les-Mimosas (Var- cote d'Azur); Haute-Corse, Vaucluse, Var, Alpes-Maritimes",,12.0,12000.0,,12012.0,,,
2017-0490-GBR,United Kingdom of Great Britain and Northern Ireland (the),Northern Europe,Europe,"Galgate (Lancashire) ,Lancaster, Appleby-in-Westmorland (Cumbria), Craven ( North Yorkshire), Llangefni, Conwy (Anglesey-Gwynedd)",,,70.0,,70.0,,,
2017-0083-GHA,Ghana,Western Africa,Africa,Brong Ahafo province,20.0,12.0,,,12.0,,,
2017-0306-GHA,Ghana,Western Africa,Africa,"Greater Accra (Weija, Tetegu - Ga South municipality), Central Region (New Tufoe, Old Praso, Kookoase, Twansukoda, Arab Area, Bankyease - Twifo Praso), Western region (Samreboi, Wassa Dunkwa, Aboi Nkwanta Samreboi communities -Wassa Amenfi West District), Eastern region (Ahiatroga community- Birim central)",,,1000000.0,,1000000.0,,,
2017-0053-GIN,Guinea,Western Africa,Africa,"Nzérékoré, Gueckedou, Matoto, Ratoma, Fria, Dubreka, Kindia, Coyah, Kaloum, Dixinn, Forécariah, Matam",,122.0,,,122.0,,,
2017-0304-GIN,Guinea,Western Africa,Africa,"Quartier commercial, Kwitiapolou, Wessoua, Dorota 1, Horaya, Gbanghana, Belle-Vue, Nyeh (Nzerekore prefecture)",,13.0,3274.0,,3287.0,,,
2017-0382-GTM,Guatemala,Central America,Americas,"Huehuetenango, Quetzaltenango, Quiché, San Marcos, Suchitepéquez, Totonicapan",,2.0,3518.0,81.0,3601.0,,,
2017-0196-GTM,Guatemala,Central America,Americas,Santa Marta and Santa Odilia (Nuevo Concepcion) San Francisco (Tiquisate),1.0,,160.0,,160.0,,,
2017-0190-GTM,Guatemala,Central America,Americas,near San Pedro Soloma,11.0,,,,,,,
2017-0416-GTM,Guatemala,Central America,Americas,"Cuyotenango, San Felipe, San Martín Zapotitlán, San Andrés Villa Seca, San Sebastián, Santa Cruz Muluá, Mazatenango’s urban centre, Colotenango’s urban centre, Calle de la Cruz, Callejón 10, Campo Borrayo municipaliaties; Icán, La otra banda and Tulula cantons; Suchitepéquez Retalhuleu departements",,,10080.0,,10080.0,,,
2017-0449-GTM,Guatemala,Central America,Americas,"Alta Verapaz, El Progreso, Petén, Quiché",,,1000.0,,1000.0,,,
2017-0450-GTM,Guatemala,Central America,Americas,"Chisec, Coban, Panzos, Raxruha, San Cristobal Verapaz, San Juan Chamlco, San Pedro Carcha, Santa Catalina La Tinta, Santa Cruz Verapaz, Tactic, Tucuru municipalities (Alta Verapaz department)",,,31319.0,,31319.0,,,
2017-0216-GUY,Guyana,South America,Americas,"Highland areas and border with Brazil; Cuyuni-Mazaruni (Region Seven), Purima, Kako, Jawalla, Phillipi, Kamarang and Duebamang, Potaro- Siparuni (Region Eight), Kaibarupai, Waipa, Chenapau, Sand Hill Settlement, Itabac and Kanapang",,,3274.0,,3274.0,,,
2017-0485-HKG,Hong Kong,Eastern Asia,Asia,,,,,,,,,
2017-0227-HND,Honduras,Central America,Americas,"Caribbean coast; Trujillo, Tocoa (Colon), Tela, La Ceiba, (Atlantida) Omoa-Cuyamel (Cortes), Laguna de Ibans in La Mosquitia (Brus Laguna), El Progreso (Yoro)",7.0,,400.0,,400.0,,,
2017-0297-HRV,Croatia,Southern Europe,Europe,"Split, municipalities of Srinjine, Žrnovnica, Podstrana and Strožanac",,80.0,,,80.0,,,
2017-0137-HTI,Haiti,Caribbean,Americas,South department,,,,,,,,
2017-0209-HTI,Haiti,Caribbean,Americas,"Grand-Anse, Nippes, Nord-Ouest (Port de Paix), Sud (Les Anglais, Roche-a-Bateaux, Les Cayes)",26.0,,,342.0,342.0,,,
2017-0530-IDN,Indonesia,South-Eastern Asia,Asia,"Jakarta,West Java (Ciamis regency), Central Java (Pekalongan) and Yogyakarta,",4.0,36.0,8859.0,,8895.0,,,
2017-0147-IDN,Indonesia,South-Eastern Asia,Asia,"Magelang district (Nipis, Sambungrejo, Citrosono villages) (Central Java provinces)",12.0,4.0,355.0,,359.0,,,
2017-0576-IDN,Indonesia,South-Eastern Asia,Asia,"East Lombok Regency (West Nusa Tenggara province), Keruak, Jerowaru, Sakra and West Sakra districts",2.0,,2280.0,,2280.0,,,
2017-0177-IDN,Indonesia,South-Eastern Asia,Asia,"Kalimantan (Borneo) and Sulawesi (Celebes): Lampasio, Baolan, Galang, Dako Pamean sub-districts (Toli-toli), Mongkonai area of Kotamugabu City (Bolaangmongondow), districts of Limboto, West Limboto, and Tibawa (Gorontalo), city of Sukadana (Ketapang)",4.0,,282345.0,75.0,282420.0,,,
2017-0102-IDN,Indonesia,South-Eastern Asia,Asia,Ponorogo discrict (Java province),28.0,17.0,,160.0,177.0,,,11000.0
2017-0059-IDN,Indonesia,South-Eastern Asia,Asia,"Jakarta (Bekasi, Jakarta)",2.0,,400.0,,400.0,,,
2017-0393-IDN,Indonesia,South-Eastern Asia,Asia,Bali (Karangasem),,,133349.0,,133349.0,,,
2017-0265-IND,India,Southern Asia,Asia,"Vaishali, Saran, Patna, Gaya, Sasaram (Rohta), Araria, Nalanda districts (Bihar)",23.0,12.0,,,12.0,,,
2017-0569-IND,India,Southern Asia,Asia,"Jamui, Champaran, Vaishali, Samastipur, Bihar",29.0,,1250.0,,1250.0,,,
2017-0570-IND,India,Southern Asia,Asia,Maldah (West Bengal),4.0,20.0,,60000.0,60020.0,,,
2017-0364-IND,India,Southern Asia,Asia,"Mumbai (Dadar, Khar, Bandra, Lalbaug, Kalina, Sion, Byculla, Matunga, Wadala, Parel, Khar-Danda, Pali Hill, Carter Road, Bandra, Ghatkopar, Bhandup, Mulund, and Santacruz), Thane (Maharashtra)",14.0,12.0,,,12.0,,78000.0,300000.0
2017-0495-IND,India,Southern Asia,Asia,Chenai (Tamil Nadu),21.0,,4000.0,,4000.0,,,
2017-0289-IND,India,Southern Asia,Asia,"Lakhimpur, Bangaigaon, Jorhat, Golaghat, Cachar, Dhemjai, Biswanath, Karimganj, Barpeta, Karbi Anglong, Sonitpur, Darrang, Hojai (Sub Division), Bhuragaon (Sub Division), Majuli, Nagaon, Nalbari, Sivasagar, Morigaon, Chirang, Dibrugarh, Dhubri, Kokrajhar, South Salmara, Charaideo, Goalpara districts (Assam)",75.0,,1735000.0,,1735000.0,,,
2017-0046-IND,India,Southern Asia,Asia,"Sonamanrg (Ganderbal district), Gurez Valleys (Jammu and Kashmir state)",28.0,,,,,,,
2017-0266-IND,India,Southern Asia,Asia,"Laptap Village, Papumpare district (Arunachal Pradesh)",22.0,,,,,,,
2017-0483-IND,India,Southern Asia,Asia,"Kotropi, Mandi district (Himachal Pradesh)",46.0,,,100.0,100.0,,,
2017-0144-IND,India,Southern Asia,Asia,"Andhra Pradesh, Telangana, Maharashtra, Odisha (Orissa)",264.0,,,,,,,
2017-0180-IND,India,Southern Asia,Asia,"Lakhimpur, Karimganj, Darrang districts (Assam), Nagaland, Manipur, Jharkhand",6.0,,100000.0,,100000.0,,,
2017-0257-IND,India,Southern Asia,Asia,Gujarat,31.0,,,,,,,
2017-0290-IND,India,Southern Asia,Asia,"Imphal West, Imphal East, Thoubal, Bishnupur (Manipur)",,,12831.0,,12831.0,,,
2017-0294-IND,India,Southern Asia,Asia,"Banaskantha, Valsad, Navsari, Surat, Sabarkantha, Patan (Gujarat), Barmer, Jalore, Udaipur, Sirohi, Pali (Rajasthan), Kolkata (West Bengal)",284.0,,520000.0,,520000.0,,,250000.0
2017-0342-IND,India,Southern Asia,Asia,"Araria, Jogbani (Bihar); Uttar Pradesh, West Bengal",514.0,,17200000.0,,17200000.0,,,1567000.0
2017-0517-IND,India,Southern Asia,Asia,"Uttar Pradesh (Siddharthnagar, Balarampur, Bahraich, Shravasti, Maharajganj, Barabanki, Lakhimpur Kheri, Gorakhpur, Muzaffarnagar, Gonda, Basti, Mirzapur, Khiri, Deoria, Sitapur, Bijnore, Faizabad, Pilibhit, Farrukhabad, Mau, Kushinagar, Badaun, Ambedkar nagar, Azamgarh, Santkabir Nagar, Ghazipur, Balia)",101.0,,2700000.0,,2700000.0,,,
2017-0490-IRL,Ireland,Northern Europe,Europe,Mountmellick (Laois),,,300.0,,300.0,,,
2017-0204-IRN,Iran (Islamic Republic of),Southern Asia,Asia,"Kopet Dag Mountain, North Khorasan province (Bojnord, Maneh, Samarghan, Ghasre-Ghajar, Qorbour, Langer, Bidak)",3.0,417.0,,1845.0,2262.0,,,2000.0
2017-0446-IRN,Iran (Islamic Republic of),Southern Asia,Asia,"Qasre-Shirin, Gilane-Garb, Kermanshah, Sare-Pule-Zahab, , Islamabad- E- Gharb, Dalahoo, Javanrood (Ezgeleh), Salase-Babajani (Kermanshah province), Ilam city, Mehran City (Ilam)",444.0,9000.0,200000.0,,209000.0,,,740000.0
2017-0521-IRN,Iran (Islamic Republic of),Southern Asia,Asia,"Tehran region (Malard, Alborz), Saveh city",2.0,120.0,,,120.0,,,
2017-0472-IRN,Iran (Islamic Republic of),Southern Asia,Asia,"Golestan, Khorazan, Khorazan Razavi provinces; Ilam, Semnan",18.0,,2000.0,,2000.0,,,35000.0
2017-0446-IRQ,Iraq,Western Asia,Asia,"Sulaymaniyah governorate areas, Kalar, Darbandikhan, Khanaqin and Halabja, Sulaymaniyah, Erbil",10.0,469.0,5500.0,,5969.0,,,
2017-0349-ITA,Italy,Southern Europe,Europe,"Casamicciola Terme, Lacco Ameno (Ischia Isl.), near Flegrea coast of Campania (Naples province)",2.0,42.0,2600.0,,2642.0,,,
2017-0544-ITA,Italy,Southern Europe,Europe,"Emilia Romagna (between Sorbolo and Boretto (Parma, Reggio Emilia), Lentigione village, Brescello, Colorno), Tuscany (Lucca)",,,1000.0,,1000.0,,48000.0,125000.0
2017-9296-ITA,Italy,Southern Europe,Europe,"Calabria, Abruzzo, Campania, Tuscany, Emilia Romagna (Parma, Piacenza ), Puglia, Sardinia, Lazio, Lombardy, Umbria, Marche, Sicily, Piemonte (Alessandria, Asti, Cuneo), Trentino-South Tyrol (Val di Non, Val Sun, Valsugana)",,,,,,,,2300000.0
2017-0137-JAM,Jamaica,Caribbean,Americas,"Clarendon, Kingston, Manchester, Portland, St. Ann, St. Catherine, St. Mary and St. Thomas.",,,5000.0,,5000.0,,,
2017-0327-JPN,Japan,Eastern Asia,Asia,"Wakayama prefecture; Mie region, Kagoshima (Yakushima, Minami-ko towns), Miyazaki, Oita, Fukuoka Prefectures, Hyogo Prefecture",2.0,51.0,1338.0,,1389.0,,,2000.0
2017-0220-KAZ,Kazakhstan,Central Asia,Asia,"Akmola (Atsbasar), Aktobe, East Kazakhstan, Zhambyl, Karaganda, Kostanay, and North regions",,,7000.0,,7000.0,,,
2017-0205-KEN,Kenya,Eastern Africa,Africa,"Coastal, Central, Northeastern, Western regions; Mombasa, Kwale, Taveta, Dadaab camp",26.0,,25000.0,,25000.0,194000.0,,
2017-0557-KEN,Kenya,Eastern Africa,Africa,"Embu, Garissa, Kirinyaga, Mombasa, Nairobi, Turkana, Wajir",76.0,3967.0,,,3967.0,,,
2017-0447-KEN,Kenya,Eastern Africa,Africa,Trans Nzoia County,,1.0,,,1.0,,,
2017-0552-KEN,Kenya,Eastern Africa,Africa,Mombasa,,453.0,,,453.0,,,
2017-0451-KGZ,Kyrgyzstan,Central Asia,Asia,"Karamyk, Jekendi, Kara-Teyit, Chuluk, Shibee villages (Chong Alay District, Osh province), Kadamjai District of the Batken Province",,,5000.0,,5000.0,,,
2017-0146-KGZ,Kyrgyzstan,Central Asia,Asia,Ayu village (Uzgen - Osh region),24.0,,,55.0,55.0,,,
2017-0381-KNA,Saint Kitts and Nevis,Caribbean,Americas,,,,500.0,,500.0,,2300.0,20000.0
2017-0443-KOR,Korea (the Republic of),Eastern Asia,Asia,"Near Pohang, Gyeongsangbuk-do province",,57.0,5000.0,,5057.0,,,
2017-0281-LAO,Lao People's Democratic Republic (the),South-Eastern Asia,Asia,"Borikhamxay province (Thongsaen, Napae villages)",,,,,,,,
2017-0307-LKA,Sri Lanka,Southern Asia,Asia,"Colombo, Gampaha, Kalutara, Kandy, Matalen Nuwara Eliya, Galle, Hambantota, Matara, Jaffna, Kilinochchi, Mannar, Vavuniya, Mulativu, Batticaloa, Ampara, Trincomalee, Kurunegala, Puttalam, Anuradhapura, Polonnaruwa, Badulla, Moneragala, Ratnapura, Kegalle, Kamunai districts",320.0,155715.0,,,155715.0,,,
2017-0493-LKA,Sri Lanka,Southern Asia,Asia,"Telippalai, Pointpedro, Kopay, Maruthankrny, Chenkannai (Jaffna district, Northern province)",9.0,,13197.0,,13197.0,,,
2017-0032-MAR,Morocco,Northern Africa,Africa,"Oriental,Taza-Al Hoceima-Tounate, Tanger-Tétouan, Fes Boulame provinces",,,900000.0,,900000.0,,,
2017-0054-MAR,Morocco,Northern Africa,Africa,"Figuig district (Oriental province), Taza district (Taza - Al Hoceima - Taounate province), Azilal district (Tadla - Azilal province), Chichaoua district (Marrakech - Tensift - Al Haouz province), Guercif (Taza)",,,750000.0,,750000.0,,,
2017-0411-MDG,Madagascar,Eastern Africa,Africa,"Mangoro Alaotra, Amoron'i Mania, Analamanga, Atsinanana, Betsiboka, Boeny, Bongolava, Haute Matsiatra, Itasy, Sava, Vakinakaratra",207.0,2384.0,,,2384.0,,,
2017-0498-MEX,Mexico,Central America,Americas,"Nuevo Laredo, Madero, Altamira, Tampico, Guemez, Hidalgo (Tamaulipas)",2.0,,800.0,,800.0,,,
2017-0152-MMR,Myanmar,South-Eastern Asia,Asia,"Chin, Ayeyarwady, Magway, Sagaing, Rakhine (worst is Buthidaung, Maungdaw-Arakan ) state",,,107520.0,,107520.0,,,
2017-0466-MNG,Mongolia,Eastern Asia,Asia,"Otgontenger mountain (Khangai mountain range, Zavkhan province)",17.0,,,,,,,
2017-0553-MOZ,Mozambique,Eastern Africa,Africa,"Nampula, Cabo Delgado",1.0,1799.0,,,1799.0,,,
2017-0549-MWI,Malawi,Eastern Africa,Africa,"Lilongwe, Karonga, Salima, Rumphi, Dowa, Likoma, and Blantyre",6.0,,450.0,,450.0,,,
2017-0123-MWI,Malawi,Eastern Africa,Africa,"Kyungu, Kilipula, Mwakoboko (Karonga district)",,,55921.0,,55921.0,,,
2017-0516-MYS,Malaysia,South-Eastern Asia,Asia,"Kelantan (Kota Bharu, Pasir Mas, Tumpat, Bachok, Tanah Merah, Pasir Puteh, Kuala Krai, Machang, Jeli) and Terengganu (Besut, Kuala Terengganu, Marang, Dungun, Setiu, Kuala Nerus)",2.0,,13000.0,,13000.0,,,
2017-0224-MYS,Malaysia,South-Eastern Asia,Asia,"7 states in Peninsular Malaysia (Kelantan, Terengganu, Johor, Pahang, Malacca, Selangor, Perak, Sabah)",,,5481.0,,5481.0,,,
2017-0477-MYS,Malaysia,South-Eastern Asia,Asia,"Penang, Kedah, Perak",7.0,,3500.0,,3500.0,,,
2017-0106-NAM,Namibia,Southern Africa,Africa,"Oshana, Omusati, Ohangwena, Zambezi regions",,,2502.0,,2502.0,,,
2017-0186-NER,Niger (the),Western Africa,Africa,"Tillabéri, Niamey, Maradi, Zinder",16.0,,3000.0,,3000.0,,,
2017-0118-NER,Niger (the),Western Africa,Africa,"Agadez, Diffa, Dosso, Maradi, Niamey, Tahoua, Tillabery, Zinder",84.0,1294.0,,,1294.0,,,
2017-0305-NER,Niger (the),Western Africa,Africa,"Bosso, Diffa, Goudoumaria, Maine Soroa, N'Guigmi districts",34.0,1096.0,,,1096.0,,,
2017-0370-NER,Niger (the),Western Africa,Africa,"Agadez, Diffa, Dosso, Maradi, Niamey, Tahoua, Tillabery,Zinder",56.0,,206513.0,,206513.0,,,10000.0
2017-0318-NGA,Nigeria,Western Africa,Africa,"Asa, Ilorin East, Ilorin South, Ilorin West, Moro (Kwara state)",11.0,1558.0,,,1558.0,,,
2017-0315-NGA,Nigeria,Western Africa,Africa,"Ngala, Mobbar, Monguno",,146.0,,,146.0,,,
2017-0272-NGA,Nigeria,Western Africa,Africa,"Ekiti, Osun, Akwa Ibom, Kebbi, Niger (Suleja, Tafa), Kwara, Ebonyi, Enugu, Abia, Oyo (Ibadan), Lagos (Victoria Island, Lekki, Oniru), Plateau, Sokoto, Edo, Bayelsa",20.0,,,500.0,500.0,5100.0,,
2017-0378-NGA,Nigeria,Western Africa,Africa,"Benue (Makurdi), Kogi (Lokoja, Sarkin Noma suburbs, Ibaji, Igalamela-Odolu, Ajaokuta, Bassa, Koton-Karfe ) states",,,10000.0,,10000.0,,,
2017-0410-NIC,Nicaragua,Central America,Americas,"Rivas, Chontales, Madriz, Boaco, Rio San Juan, Nueva Segovia, Carazo, Granada and North Caribbean (Bilwi, Waspam, Prinzapolka, Siuna, Rosita, Bonanza)",15.0,,39200.0,,39200.0,,,
2017-0449-NIC,Nicaragua,Central America,Americas,"Teustepe, San Lorenzo, Tipitapa, Mateare, Managua, Granada, Bocana de Paiwas, Jinotega, Rosita (Las Minas)",7.0,,13565.0,150.0,13715.0,,,
2017-0181-PAK,Pakistan,Southern Asia,Asia,"Lahore, Faisalabad, Sialkot, Gujranwala, Kasur, Bahawalnagar, Multan, Chichawatni (Sahiwal), Lodhran, Rajanpur, Sheikupura, Nankana Sahib (Sheikupura) (Punjab)",15.0,113.0,,,113.0,,,
2017-0385-PAK,Pakistan,Southern Asia,Asia,Khyber Pakhtunkhwa,25.0,2492.0,,,2492.0,,,
2017-0045-PAK,Pakistan,Southern Asia,Asia,"Turbat (Kech); Gwadar, Panjgur, Pishin, Ziarat, Qila Abdullah districts (Balochistan province)",13.0,650.0,60000.0,,60650.0,,,
